16549637	This administrative claims-based model for profiling hospitals performs consistently over several years and produces estimates of risk-standardized mortality that are good surrogates for estimates from a medical record model.
18540730	The authors conducted a meta-analytic review to assess the prevalence of major depressive disorder and depressive symptoms among Latinos compared with non-Latino Whites in the United States using community-based data. Random-effects estimates were calculated for 8 studies meeting inclusion criteria that reported lifetime prevalence of major depressive disorder (combined N = 76,270) and for 23 studies meeting inclusion criteria that reported current prevalence of depressive symptoms (combined N = 38,997). Findings did not indicate a group difference in lifetime prevalence of major depressive disorder (odds ratio = 0.89, 95% confidence interval = 0.72, 1.10). Latinos reported more depressive symptoms than non-Latino Whites (standardized mean difference = 0.19, 95% confidence interval = 0.12, 0.25); however, this effect was small and does not appear to suggest a clinically meaningful preponderance of depressive symptoms among Latinos. Findings are examined in the context of theories on vulnerability and resilience, and recommendations for future research are discussed.
16120847	These recommendations should be equally applicable to stroke patients receiving rehabilitation in all medical system settings and are not based on clinical problems or resources unique to the Federal Medical System.
19819502	The proportion of STEMI patients treated with reperfusion has improved but the interval to its application has not been shortened. To improve the latter it is mandatory an earlier contact with the medical system, a shortening of the intervals door-needle and door-balloon through better coordination between the 061, the sanitary personnel and the hospital administration, and to consider the subject as a real sanitary priority.
16442483	Little attention has been paid to the symptom management needs of patients with life-threatening diseases other than cancer. In this study, we aimed to determine to what extent patients with progressive chronic diseases have similar symptom profiles. A systematic search of medical databases (MEDLINE, EMBASE, and PsycINFO) and textbooks identified 64 original studies reporting the prevalence of 11 common symptoms among end-stage patients with cancer, acquired immunodeficiency syndrome (AIDS), heart disease, chronic obstructive pulmonary disease, or renal disease. Analyzing the data in a comparative table (a grid), we found that the prevalence of the 11 symptoms was often widely but homogeneously spread across the five diseases. Three symptoms-pain, breathlessness, and fatigue-were found among more than 50% of patients, for all five diseases. There appears to be a common pathway toward death for malignant and nonmalignant diseases. The designs of symptom prevalence studies need to be improved because of methodological disparities in symptom assessment and designs.
12093204	Aspirin (or another oral antiplatelet drug) is protective in most types of patient at increased risk of occlusive vascular events, including those with an acute myocardial infarction or ischaemic stroke, unstable or stable angina, previous myocardial infarction, stroke or cerebral ischaemia, peripheral arterial disease, or atrial fibrillation. Low dose aspirin (75-150 mg daily) is an effective antiplatelet regimen for long term use, but in acute settings an initial loading dose of at least 150 mg aspirin may be required. Adding a second antiplatelet drug to aspirin may produce additional benefits in some clinical circumstances, but more research into this strategy is needed.
8151849	Major depression in patients hospitalized following an MI is an independent risk factor for mortality at 6 months. Its impact is at least equivalent to that of left ventricular dysfunction (Killip class) and history of previous MI. Additional study is needed to determine whether treatment of depression can influence post-MI survival and to assess possible underlying mechanisms.
12625795	Many depressed patients present to primary care physicians instead of psychiatrists, and several studies have found that primary care physicians underdiagnose and undertreat depression. Primary care physicians may fail to diagnose and treat depression for many reasons: depression as it appears in primary care is in many ways a different disease than that seen in the psychiatric setting, and the process of detecting and treating it is different as well. Primary care clinicians face 2 main tasks when addressing depression in routine practice: to accurately identify those patients who are most likely to benefit from antidepressant treatment and to provide the best treatment options possible in the limited time available per visit. Treatment algorithms can be useful, but they are often difficult to apply in primary care. This article reviews the evidence about the detection and treatment of depression in primary care, examines current research on the differences between the primary and specialty care environments, and discusses aspects of treatment guidelines and algorithms that are important to primary care physicians.
12583858	This blood-pressure-lowering regimen reduced the risk of stroke among both hypertensive and non-hypertensive individuals with a history of stroke or transient ischaemic attack. Combination therapy with perindopril and indapamide produced larger blood pressure reductions and larger risk reductions than did single drug therapy with perindopril alone. Treatment with these two agents should now be considered routinely for patients with a history of stroke or transient ischaemic attack, irrespective of their blood pressure.
17606951	Accounting models provide less precise estimates of disease burden than do econometric models. The authors seek to improve these estimates for cardiovascular disease using a nationally representative survey and econometric modeling to isolate the proportion of medical expenditures attributable to four chronic cardiovascular diseases: stroke, hypertension, congestive heart failure, and other heart diseases. Approximately 17% of all medical expenditures, or $149 billion annually, and nearly 30% of Medicare expenditures are attributable to these diseases. Of the four diseases, hypertension accounts for the largest share of prescription expenditures across payers and the largest share of all Medicaid expenditures. The large number of people with cardiovascular disease who are eligible for both Medicare and Medicaid could lead to large shifts in the burden to these payers as prescription drug coverage is included in Medicare. A societal perspective is important when describing the economic burden of cardiovascular disease.
17826154	Depression produces the greatest decrement in health compared with the chronic diseases angina, arthritis, asthma, and diabetes. The comorbid state of depression incrementally worsens health compared with depression alone, with any of the chronic diseases alone, and with any combination of chronic diseases without depression. These results indicate the urgency of addressing depression as a public-health priority to reduce disease burden and disability, and to improve the overall health of populations.
11694107	Essential hypertension is the most common diagnosis in US primary care settings for middle-aged persons and seniors. Yet, data on hypertension screening, treatment, and control in such settings are limited. We analyzed National Ambulatory Medical Care Survey data to examine the rates of and factors associated with hypertension screening, treatment, and control during US office visits in 2003 and 2004. Blood pressure was measured in 56% (95% confidence limits: 52% to 59%) of all visits by patients > or =18 years of age and in 93% (95% confidence limits: 89% to 96%) of hypertensive patient visits. Among the latter, 62% (95% confidence limits: 55% to 69%) were treated. Diuretics were the most commonly prescribed antihypertensive agents (46%; 95% confidence limits: 41% to 50%), and combination therapy was reported in 58% (95% confidence limits: 54% to 63%) of treated visits. Only 39% (95% confidence limits: 34% to 43%) of treated visits were at recommended blood pressure goals. The odds of not being screened for hypertension were notably greater for visits with a provider other than a primary care physician or cardiologist (10.0; 95% confidence limits: 5.5 to 16.7) and for nonwell care visits (5.6; 95% confidence limits: 3.6 to 8.3). Greater odds of not being treated for hypertension were noted by geographic region (South versus Northeast: 2.6; 95% confidence limits: 1.2 to 5.6) and visit type (first time versus return visits; 1.6; 95% confidence limits: 1.1 to 2.4). The odds of not having blood pressure controlled were greater for patients with comorbidities (1.6; 95% confidence limits: 1.1 to 2.4). In conclusion, more intervention efforts are needed to further reduce the gaps and variations in routine practice in relation to evidence-based practice guidelines for hypertension screening, treatment, and control.
19681102	Ischemic stroke tPA treatment within 4.5h seems to improve functional outcomes and increases symptomatic intracranial hemorrhage rates without significantly increasing mortality.
17418085	Bisphosphonates are effective in the prevention and treatment of bone disease in multiple myeloma (MM). Osteonecrosis of the jaw is Increasingly recognized as a serious complication of long-term bisphosphonate therapy. Issues such as the choice of bisphosphonate and duration of therapy have become the subject of intense debate given patient safety concerns. We reviewed available data concerning the use of bisphosphonates in MM. Guidelines for the use of bisphosphonates in MM were developed by a multidisciplinary panel consisting of hematologists, dental specialists, and nurses specializing in the treatment of MM. We conclude that intravenous pamidronate and intravenous zoledronic acid are equally effective and superior to placebo in reducing skeletal complications. Pamidronate is favored over zoledronic acid until more data are available on the risk of complications (osteonecrosis of the jaw). We recommend discontinuing bisphosphonates after 2 years of therapy for patients who achieve complete response and/or plateau phase. For patients whose disease is active, who have not achieved a response, or who have threatening bone disease beyond 2 years, therapy can be decreased to every 3 months. These guidelines were developed in the Interest of patient safety and will be reexamined as new data emerge regarding risks and benefits.
2014943	Our data indicated that alternate-day aspirin therapy greatly reduced the risk for first myocardial infarction among patients with chronic stable angina, a group of patients at high risk for cardiovascular death (P less than 0.001). Although our results for stroke were based on small numbers, they suggested an apparent increase in frequency of stroke with aspirin therapy; this finding requires confirmation in randomized trials of adequate sample size.
1550000	The effect of participation in cardiac rehabilitation on medical costs was determined by measuring hospitalization charges for cardiac admissions over a 3-year period in 580 post-coronary event patients (58% after coronary bypass surgery, 42% after myocardial infarction), of whom 230 entered a cardiac rehabilitation program and 350 did not. Baseline left ventricular ejection fraction was similar in entrants and nonentrants (59.9% vs 59.5%). Over the 1 to 46-month follow-up period (mean 21 months), per capita hospitalization charges for participants in cardiac rehabilitation were $739 lower than charges for nonparticipants ($1197 +/- 3911 vs $1936 +/- 5459, p = 0.022). This was due to both a lower incidence of hospitalizations and lower charges per hospitalization. Inasmuch as groups differed with regard to age, sex, diagnostic category, and smoking status, data were adjusted for these baseline differences by means of analysis of covariance. Rehospitalization charges remained significantly higher in nonparticipants (p = 0.015). Because physician charges were not measured, the cost differential between groups is underestimated. Results of this study show an association between participation in comprehensive cardiac rehabilitation and lowered cardiac rehospitalization costs in the years after an acute coronary event.
21678374	Although we have been able to expand the number of participants by 16% in this update, we still find paucity of data on outcomes and the bias risk of the trials was mostly considered high. Targeting intensive glycaemic control compared with conventional glycaemic control did not show significant differences for all-cause mortality and cardiovascular mortality. Targeting intensive glycaemic control seemed to reduce the risk of microvascular complications, if we disregard the risks of bias, but increases the risk of hypoglycaemia and serious adverse events.
15078788	Most deaths from pulmonary embolism among patients hospitalized for other conditions occurred in the setting of failed prophylaxis rather than omitted prophylaxis. High-risk patients, especially medical service patients, warrant intensive VTE prophylaxis and close follow-up to ensure successful outcomes.
15487094	A comprehensive transitional care intervention for elders hospitalized with heart failure increased the length of time between hospital discharge and readmission or death, reduced total number of rehospitalizations, and decreased healthcare costs, thus demonstrating great promise for improving clinical and economic outcomes.
17911503	In the Medicare population, women are significantly less likely than men to receive ICD therapy for primary or secondary prevention of sudden cardiac death.
18212309	Less than 40% of potentially eligible patients hospitalized for heart failure received ICD therapy, and rates of use were lower among eligible women and black patients than among white men.
19021225	Low-income children with SCD demonstrate significantly higher healthcare utilization for inpatient care, emergency center care, and home health care compared to children with similar socio-demographic characteristics. A substantial proportion of children with SCD may fail to meet minimum guidelines for outpatient primary and hematology comprehensive care.
19716954	Bayer Schering Pharma AG, Johnson & Johnson Pharmaceutical Research & Development.
17509812	The suffering of patients with incurable cancer is determined to a large degree by the presence and intensity of the symptoms of their disease. Knowledge of symptom prevalence is important for clinical practice. The main aim of this study was to obtain a reliable estimation of symptom prevalence in patients with incurable cancer by performing a systematic review of studies assessing this topic. We included 44 studies (including 25,074 patients) on overall symptom prevalence (Group 1) and six studies (including 2,219 patients) on symptom prevalence during the last one to two weeks of life (Group 2). In these studies, symptom prevalence was assessed by a questionnaire, a standardized interview, or the medical record. We identified 37 symptoms assessed in at least five studies. Almost all symptoms occurred in more than 10% of the patients. Five symptoms (fatigue, pain, lack of energy, weakness, and appetite loss) occurred in more than 50% of the patients of Group 1. Weight loss occurred significantly more often in Group 2 compared to Group 1, and pain, nausea, and urinary symptoms occurred significantly less often. Generally, symptom prevalence was highest if assessed by a questionnaire. The results of this study should be used to guide doctors and nurses in symptom management. Proper attention to symptom burden and suffering should be the basis for individually tailored treatment aimed at improving or maintaining quality of life of patients in their last period of life.
12506938	Ramipril significantly reduces the rates of death, myocardial infarction, and stroke in a broad range of high-risk patients who are not known to have a low ejection fraction or heart failure.
18235423	Each year, approximately 865,000 persons in the United States have a myocardial infarction (i.e., heart attack). In 2007, direct and indirect costs of heart disease were estimated at approximately $277.1 billion. Cardiac rehabilitation, an essential component of recovery care after a heart attack, focuses on cardiovascular risk reduction, promoting healthy behaviors, reducing death and disability, and promoting an active lifestyle for heart attack survivors. Current guidelines from the American Heart Association (AHA) and the American Association of Cardiovascular and Pulmonary Rehabilitation emphasize the importance of cardiac rehabilitation, which reduces morbidity and mortality, improves clinical outcomes, enhances psychological recovery, and decreases the risk for secondary cardiac events. To estimate the prevalence of receipt of outpatient cardiac rehabilitation among heart attack survivors in 21 states and the District of Columbia (DC), data from the 2005 Behavioral Risk Factor Surveillance System (BRFSS) were assessed. The results of that assessment indicated that 34.7% of BRFSS respondents who had experienced a heart attack participated in outpatient cardiac rehabilitation. Outpatient cardiac rehabilitation for eligible patients after a heart attack is an essential component of care that should be incorporated into treatment plans. Increasing the number of persons who participate in cardiac rehabilitation services also can reduce health-care costs for recurrent events and reduce the burden on families and caregivers of patients with serious sequelae.
15784104	Adults with asthma and documented concomitant AR experienced more asthma-related hospitalizations and GP visits, and incurred higher asthma drug costs than did adults with asthma alone. A unified treatment strategy for asthma and AR might reduce the costs of treating these conditions.
18294565	Current risk schemes have comparable, but only limited, overall ability to predict thromboembolism in persons with AF. Recommendations for antithrombotic therapy may vary widely depending on which scheme is applied for individual patients. Better risk stratification is crucially needed to improve selection of AF patients for anticoagulant therapy.
16973925	The aim of this new statement is to provide comprehensive and timely evidence-based recommendations on the prevention of ischemic stroke among survivors of ischemic stroke or transient ischemic attack. Evidence-based recommendations are included for the control of risk factors, interventional approaches for atherosclerotic disease, antithrombotic treatments for cardioembolism, and the use of antiplatelet agents for noncardioembolic stroke. Further recommendations are provided for the prevention of recurrent stroke in a variety of other specific circumstances, including arterial dissections; patent foramen ovale; hyperhomocysteinemia; hypercoagulable states; sickle cell disease; cerebral venous sinus thrombosis; stroke among women, particularly with regard to pregnancy and the use of postmenopausal hormones; the use of anticoagulation after cerebral hemorrhage; and special approaches for the implementation of guidelines and their use in high-risk populations.
17975193	Automated review of EHR data to measure the quality of care of outpatients with heart failure missed many exclusion criteria for medications documented only in providers' notes. As a result, it sometimes underestimated performance on medication-based quality measures.
1978091	796 men with unstable coronary artery disease (unstable angina or non-Q-wave myocardial infarction [MI] ), were randomised to double-blind placebo-controlled treatment with oral aspirin 75 mg/day and/or 5 days of intermittent intravenous heparin. The risk of MI and death was reduced by aspirin. After 5 days the risk ratio was 0.43 (confidence intervals, 0.21-0.91), at 1 month 0.31 (0.18-0.53), and at 3 months 0.36 (0.23-0.57). Aspirin reduced event rate in non-Q-wave MI and unstable angina, independently of electrocardiographic abnormalities or concurrent drug therapy. Heparin had no significant influence on event rate, although the group treated with aspirin and heparin had the lowest number of events during the initial 5 days. Treatment had few side-effects and high patient compliance.
17185305	Both physician and patient factors play a part in CR enrollment. Patient CR barriers should be addressed during referral discussions, and reasons why physicians fail to uniformly endorse CR exploration. Although distance to CR was related to patient enrollment patterns, greater access to home-based CR services should be provided.
20448205	Management of patients with acute ischemic stroke remains multifaceted and includes several aspects of care that have not been tested in clinical trials. This statement includes recommendations for management from the first contact by emergency medical services personnel through initial admission to the hospital. Intravenous administration of recombinant tissue plasminogen activator remains the most beneficial proven intervention for emergency treatment of stroke. Several interventions, including intra-arterial administration of thrombolytic agents and mechanical interventions, show promise. Because many of the recommendations are based on limited data, additional research on treatment of acute ischemic stroke is needed.
18364644	These data support the routine assessment of high-risk behavioral characteristics in patients with CAD and demonstrate the marked improvements that occur after phase II CRET programs in CAD patients with high psychological distress.
11980514	Current management of advanced heart failure is based more on consensus than on randomized trials. Systematic investigation should address not only new therapies but also strategies for selecting and optimizing therapies already available.
8998892	The use of different types of antithrombotic prophylactics in various clinical settings was examined. A standardized questionnaire was mailed to 5000 randomly selected practicing orthopaedic surgeons that detailed practice profile, surgical case type and frequency, method of thromboembolism prophylaxis used, incidence of morbidity, and type of screening used. Twenty-one percent (n = 1046) of surgeons surveyed returned the questionnaire. Four of 5 surgeons performing elective hip arthroplasty used some form of thromboembolic prophylaxis for all of their patients, 13% used prophylaxis only for patients considered to be at high risk, and 3% of respondents never used prophylaxis. The rates of prophylactic use for patients undergoing elective knee arthroplasty were similar. A considerably lower rate of routine prophylactic use was seen among surgeons performing surgery for pelvic and lower extremity trauma. Except for cases involving neurologic compromise, most patients undergoing either elective or traumatic spinal surgery were not given prophylaxis. Low dose warfarin alone was the most commonly used prophylaxis modality. A comparison of the results of the current survey with those of past surveys showed that the use of aspirin has fallen. The use of routine pharmacologic prophylaxis against thromboembolism in hip and knee arthroplasty has become the standard of care in the United States. Among patients undergoing surgery for hip fracture and other lower extremity trauma, however, prophylaxis remains underused.
16084283	The goal of risk stratification of CVD inpatients with CKD is to lead to effective and early intervention and to prevent the adverse outcomes associated with this complex multisystem disease that is characteristic of growing number of patients with CKD in the general population and of patients receiving dialysis therapy or kidney transplantation. By 2030, there will be 2.24 million patients with ESRD in the United States, and approximately 1.3 million of these cases of ESRD will be caused by diabetes mellitus. Thus, CVD in this high-risk population presents a challenge for the nephrology and the cardiology community.
9935025	The underuse of echocardiography appears to be associated with poorer survival and underuse of angiotensin-converting enzyme inhibitor therapy.
