16675728	Extensive evidence is available identifying a variety of specific factors that increase the risk of a first stroke and providing strategies for reducing that risk.
15701916	Assuming equal effectiveness in stroke prevention and decreased hemorrhage risk, ximelagatran is not likely to be cost-effective in patients with atrial fibrillation unless they have a high risk of intracranial hemorrhage or a low quality of life with warfarin.
15052108	The reported outcomes statement is an update to the previous recommendations for outcomes evaluation in cardiac rehabilitation/secondary prevention programs. The purposes of outcomes evaluation are reviewed, and practical information with examples is provided to help programs implement an outcomes-directed approach within routine patient care and program management functions.
12711500	Throughout middle and old age, usual blood pressure is strongly and directly related to vascular (and overall) mortality, without any evidence of a threshold down to at least 115/75 mm Hg.
22184711	Neither clinic nor home measurement had sufficient sensitivity or specificity to be recommended as a single diagnostic test. If ambulatory monitoring is taken as the reference standard, then treatment decisions based on clinic or home blood pressure alone might result in substantial overdiagnosis. Ambulatory monitoring before the start of lifelong drug treatment might lead to more appropriate targeting of treatment, particularly around the diagnostic threshold.
18039450	The consensus document establishes the following priorities: 1. To apply the set of general measures recommended for the care of STEMI patients strictly and appropriately 2. To foster the use of early reperfusion in as many patients as possible, promoting the extension of fibrinolysis outside of hospitals and referral to a center with facilities for primary percutaneous coronary intervention. 3. To monitor and evaluate the management of these patients, with special attention placed on outcome and safety.
17335357	An integrated multifactorial approach is essential in addressing the underutilization of therapies available for secondary prevention of CAD. Managed care organizations are in a unique position to optimize the use of evidence-based pharmacological and behavioral therapies to effectively prevent and treat the underlying pathophysiology of CAD in member populations.
14981060	The National High Blood Pressure Education Program presents the complete Seventh Report of the Joint National Committee on Prevention, Detection, Evaluation, and Treatment of High Blood Pressure. Like its predecessors, the purpose is to provide an evidence-based approach to the prevention and management of hypertension. The key messages of this report are these: in those older than age 50, systolic blood pressure (BP) of greater than 140 mm Hg is a more important cardiovascular disease (CVD) risk factor than diastolic BP; beginning at 115/75 mm Hg, CVD risk doubles for each increment of 20/10 mm Hg; those who are normotensive at 55 years of age will have a 90% lifetime risk of developing hypertension; prehypertensive individuals (systolic BP 120-139 mm Hg or diastolic BP 80-89 mm Hg) require health-promoting lifestyle modifications to prevent the progressive rise in blood pressure and CVD; for uncomplicated hypertension, thiazide diuretic should be used in drug treatment for most, either alone or combined with drugs from other classes; this report delineates specific high-risk conditions that are compelling indications for the use of other antihypertensive drug classes (angiotensin-converting enzyme inhibitors, angiotensin-receptor blockers, beta-blockers, calcium channel blockers); two or more antihypertensive medications will be required to achieve goal BP (<140/90 mm Hg, or <130/80 mm Hg) for patients with diabetes and chronic kidney disease; for patients whose BP is more than 20 mm Hg above the systolic BP goal or more than 10 mm Hg above the diastolic BP goal, initiation of therapy using two agents, one of which usually will be a thiazide diuretic, should be considered; regardless of therapy or care, hypertension will be controlled only if patients are motivated to stay on their treatment plan. Positive experiences, trust in the clinician, and empathy improve patient motivation and satisfaction. This report serves as a guide, and the committee continues to recognize that the responsible physician's judgment remains paramount.
18574271	This article discusses the prevention of venous thromboembolism (VTE) and is part of the Antithrombotic and Thrombolytic Therapy: American College of Chest Physicians Evidence-Based Clinical Practice Guidelines (8th Edition). Grade 1 recommendations are strong and indicate that the benefits do or do not outweigh risks, burden, and costs. Grade 2 suggestions imply that individual patient values may lead to different choices (for a full discussion of the grading, see the "Grades of Recommendation" chapter by Guyatt et al). Among the key recommendations in this chapter are the following: we recommend that every hospital develop a formal strategy that addresses the prevention of VTE (Grade 1A). We recommend against the use of aspirin alone as thromboprophylaxis for any patient group (Grade 1A), and we recommend that mechanical methods of thromboprophylaxis be used primarily for patients at high bleeding risk (Grade 1A) or possibly as an adjunct to anticoagulant thromboprophylaxis (Grade 2A). For patients undergoing major general surgery, we recommend thromboprophylaxis with a low-molecular-weight heparin (LMWH), low-dose unfractionated heparin (LDUH), or fondaparinux (each Grade 1A). We recommend routine thromboprophylaxis for all patients undergoing major gynecologic surgery or major, open urologic procedures (Grade 1A for both groups), with LMWH, LDUH, fondaparinux, or intermittent pneumatic compression (IPC). For patients undergoing elective hip or knee arthroplasty, we recommend one of the following three anticoagulant agents: LMWH, fondaparinux, or a vitamin K antagonist (VKA); international normalized ratio (INR) target, 2.5; range, 2.0 to 3.0 (each Grade 1A). For patients undergoing hip fracture surgery (HFS), we recommend the routine use of fondaparinux (Grade 1A), LMWH (Grade 1B), a VKA (target INR, 2.5; range, 2.0 to 3.0) [Grade 1B], or LDUH (Grade 1B). We recommend that patients undergoing hip or knee arthroplasty or HFS receive thromboprophylaxis for a minimum of 10 days (Grade 1A); for hip arthroplasty and HFS, we recommend continuing thromboprophylaxis > 10 days and up to 35 days (Grade 1A). We recommend that all major trauma and all spinal cord injury (SCI) patients receive thromboprophylaxis (Grade 1A). In patients admitted to hospital with an acute medical illness, we recommend thromboprophylaxis with LMWH, LDUH, or fondaparinux (each Grade 1A). We recommend that, on admission to the ICU, all patients be assessed for their risk of VTE, and that most receive thromboprophylaxis (Grade 1A).
18574272	This chapter about treatment for venous thromboembolic disease is part of the American College of Chest Physicians Evidence-Based Clinical Practice Guidelines (8th Edition). Grade 1 recommendations are strong and indicate that the benefits do or do not outweigh risks, burden, and costs. Grade 2 suggests that individual patient values may lead to different choices (for a full understanding of the grading, see "Grades of Recommendation" chapter). Among the key recommendations in this chapter are the following: for patients with objectively confirmed deep vein thrombosis (DVT) or pulmonary embolism (PE), we recommend anticoagulant therapy with subcutaneous (SC) low-molecular-weight heparin (LMWH), monitored IV, or SC unfractionated heparin (UFH), unmonitored weight-based SC UFH, or SC fondaparinux (all Grade 1A). For patients with a high clinical suspicion of DVT or PE, we recommend treatment with anticoagulants while awaiting the outcome of diagnostic tests (Grade 1C). For patients with confirmed PE, we recommend early evaluation of the risks to benefits of thrombolytic therapy (Grade 1C); for those with hemodynamic compromise, we recommend short-course thrombolytic therapy (Grade 1B); and for those with nonmassive PE, we recommend against the use of thrombolytic therapy (Grade 1B). In acute DVT or PE, we recommend initial treatment with LMWH, UFH or fondaparinux for at least 5 days rather than a shorter period (Grade 1C); and initiation of vitamin K antagonists (VKAs) together with LMWH, UFH, or fondaparinux on the first treatment day, and discontinuation of these heparin preparations when the international normalized ratio (INR) is > or = 2.0 for at least 24 h (Grade 1A). For patients with DVT or PE secondary to a transient (reversible) risk factor, we recommend treatment with a VKA for 3 months over treatment for shorter periods (Grade 1A). For patients with unprovoked DVT or PE, we recommend treatment with a VKA for at least 3 months (Grade 1A), and that all patients are then evaluated for the risks to benefits of indefinite therapy (Grade 1C). We recommend indefinite anticoagulant therapy for patients with a first unprovoked proximal DVT or PE and a low risk of bleeding when this is consistent with the patient's preference (Grade 1A), and for most patients with a second unprovoked DVT (Grade 1A). We recommend that the dose of VKA be adjusted to maintain a target INR of 2.5 (INR range, 2.0 to 3.0) for all treatment durations (Grade 1A). We recommend at least 3 months of treatment with LMWH for patients with VTE and cancer (Grade 1A), followed by treatment with LMWH or VKA as long as the cancer is active (Grade 1C). For prevention of postthrombotic syndrome (PTS) after proximal DVT, we recommend use of an elastic compression stocking (Grade 1A). For DVT of the upper extremity, we recommend similar treatment as for DVT of the leg (Grade 1C). Selected patients with lower-extremity (Grade 2B) and upper-extremity (Grade 2C). DVT may be considered for thrombus removal, generally using catheter-based thrombolytic techniques. For extensive superficial vein thrombosis, we recommend treatment with prophylactic or intermediate doses of LMWH or intermediate doses of UFH for 4 weeks (Grade 1B).
1554003	The effects of implementing a warfarin-monitoring service for inpatients were evaluated. The pharmacy-managed service includes chart review, laboratory interpretation, recommendations for warfarin dosage adjustments, physician and patient education, and coordination of follow-up in the outpatient anticoagulation clinic. In a before-after trial, 52 patients monitored by the warfarin-monitoring service were compared with 97 patients who received warfarin before the service was implemented. Significantly fewer determinations of prothrombin time (PT) and partial thromboplastin time (PTT) were ordered for after-trial patients compared with before-trial patients. PT stability at hospital discharge was significantly improved in after-trial patients. After-trial patients were 12.2 times more likely to be referred to the anticoagulation clinic. No difference was found between the before and after groups in overall compliance with follow-up; however, among patients with no history of substance abuse, after-trial patients were 6.7 times more likely to be compliant. The warfarin-monitoring service had no significant effect on the number of hospital visits and readmissions related to toxicity and recurrence of thrombosis. After-trial patients were 5.4 times more likely to have a therapeutic PT at the initial follow-up appointment. The warfarin-monitoring service improved warfarin dose determination, improved PT stability, and increased referrals to the anticoagulation clinic; among patients with no history of substance abuse, it also improved clinic compliance.
19579271	In this large, international, randomized trial, we found that intensive glucose control increased mortality among adults in the ICU: a blood glucose target of 180 mg or less per deciliter resulted in lower mortality than did a target of 81 to 108 mg per deciliter. (ClinicalTrials.gov number, NCT00220987.)
15383128	Individuals with bipolar disorder possess a substantial burden of general medical comorbidity, and are occurring at an earlier age than in the general VA patient population, suggesting the need for earlier detection and treatment for patients with bipolar disorder.
17940514	Use of warfarin has increased, and bleeding from warfarin use is a prevalent reaction and an important cause of mortality. Consequently, a "black box" warning about warfarin's bleeding risk was added to the US product labeling in 2006. Physicians and nurses should tell patients to immediately report signs and symptoms of bleeding. A Medication Guide, which is required to be provided with each prescription, reinforces this message.
8526459	According to high-quality evidence, enhanced glucose control significantly prevents the development of clinical neuropathy and reduces nerve conduction and vibration threshold abnormalities in type 1 diabetes mellitus. In type 2 diabetes mellitus, enhanced glucose control reduces the incidence of clinical neuropathy, although this was not formally statistically significant (P = 0.06). However, enhanced glucose control does significantly reduce nerve conduction and vibration threshold abnormalities. Importantly, enhanced glucose control significantly increases the risk of severe hypoglycemic episodes, which needs to be taken into account when evaluating its risk/benefit ratio.
20959575	clinicaltrials.gov Identifier: NCT00133692.
11453714	Antihypertensive regimens that include ACE inhibitors are more effective than regimens without ACE inhibitors in slowing the progression of nondiabetic renal disease. The beneficial effect of ACE inhibitors is mediated by factors in addition to decreasing blood pressure and urinary protein excretion and is greater in patients with proteinuria. Angiotensin-converting inhibitors are indicated for treatment of nondiabetic patients with chronic renal disease and proteinuria and, possibly, those without proteinuria.
19931943	Since the advent of cardiopulmonary resuscitation more than 40 years ago, we have achieved a return to spontaneous circulation in a growing proportion of patients with cardiac arrest. Nevertheless, most of these patients die in the first few days after admission to the intensive care unit (ICU), and this situation has not improved over the years. Mortality in these patients is mainly associated to brain damage. Perhaps recognizing that cardiopulmonary resuscitation does not end with the return of spontaneous circulation but rather with the return of normal brain function and total stabilization of the patient would help improve the therapeutic management of these patients in the ICU. In this sense, the term cardiocerebral resuscitation proposed by some authors might be more appropriate. The International Liaison Committee on Resuscitation recently published a consensus document on the "Post-Cardiac Arrest Syndrome" and diverse authors have proposed that post-arrest care be integrated as the fifth link in the survival chain, after early warning, early cardiopulmonary resuscitation by witnesses, early defibrillation, and early advanced life support. The therapeutic management of patients that recover spontaneous circulation after cardiopulmonary resuscitation maneuvers based on life support measures and a series of improvised actions based on "clinical judgment" might not be the best way to treat patients with post-cardiac arrest syndrome. Recent studies indicate that using goal-guided protocols to manage these patients including therapeutic measures of proven efficacy, such as inducing mild therapeutic hypothermia and early revascularization, when indicated, can improve the prognosis considerably in these patients. Given that there is no current protocol based on universally accepted evidence, the Steering Committee of the National Cardiopulmonary Resuscitation Plan of the Spanish Society of Intensive Medicine and Cardiac Units has elaborated this document after a thorough review of the literature and an online discussion involving all the members of the committee and a consensus meeting with the aim of providing a platform for the development of local protocols in different ICSs in our country to fit their own means and characteristics.
8540789	This study demonstrates that early swallow screening and dysphagia management in patients with acute stroke reduces the risk of aspiration pneumonia, is cost effective, and assures quality care with optimal outcome.
14668421	Adjusted doses of oral warfarin sodium or fixed doses of subcutaneous low-molecular-weight heparin (LMWH) are the standard approaches for preventing venous thromboembolism following major orthopedic surgery of the legs. In recent years, new anticoagulants have been compared with either LMWH or warfarin. The optimal timing for the first dose of LMWH prophylaxis and of the new anticoagulants is controversial. Recent clinical trials of LMWH and of newer anticoagulants have provided new information on the relationship between the timing of the first anticoagulant dose and the efficacy and safety of thromboprophylaxis after major orthopedic surgery. These data on the optimal timing of initiating prophylaxis come from limited direct randomized comparisons of different timing with the same anticoagulant, subgroup analysis of large studies with a single anticoagulant, indirect comparisons across studies in systematic reviews, and single randomized trials comparing different anticoagulants. In the direct comparison of the same anticoagulant, preoperative initiation of the same regimen of LMWH (dalteparin) increased major bleeding, without improved antithrombotic efficacy compared to the early postoperative regimen. Fondaparinux, 2.5 mg, begun 6 h postoperatively is more effective and as safe as the currently approved regimens of enoxaparin begun either 12 h preoperatively, or 12 to 24 h postoperatively, in patients undergoing major orthopedic surgery. In a subgroup analysis of several large randomized trials, fondaparinux, 2.5 mg, begun < 6 h postoperatively was associated with increased major bleeding, without improved efficacy. The results of indirect comparisons also favor the use of a 6-h postoperative starting time for the first dose, while the single randomized trials comparing different anticoagulants performed to date are not helpful in establishing an optimal time for the first dose. The aggregate clinical research evidence supports the following general conclusions about the relationship between the timing of the first anticoagulant dose and the efficacy and safety of prophylaxis: (1) preoperative initiation is not required for good efficacy and, when begun within 2 h of surgery, increases major bleeding; (2) initiation at 6 h postoperatively is effective and not associated with increased major bleeding; (3) initiation < 6 h postoperatively increases major bleeding, without improved efficacy; thus, 6 h appears to be the threshold for early postoperative administration; and (4) initiation 12 to 24 h postoperatively may be less effective than initiation at 6 h, but further randomized trials comparing the same anticoagulant initiated at different times postoperatively (eg, 6 h vs 12 h) are required to establish definitively the optimal timing of the first anticoagulant dose.
6346847	The efficacy and safety of a new diuretic-antihypertensive drug, indapamide (2.5 mg/day), were evaluated in hypertensive patients with normal renal function, in patients with various degrees of chronic renal failure, and in hypertensive patients undergoing long-term maintenance hemodialysis. The results obtained from single-blind, placebo-controlled studies indicate that indapamide is a safe and effective agent to use in lowering the blood pressure of hypertensive patients with normal renal function, those with various degrees of renal impairment, and those who are undergoing long-term maintenance hemodialysis. No significant side or toxic effects were noted in these studies. Furthermore, indapamide does not accumulate in the bloodstream of patients with renal impairment and is not dialyzable.
20732656	Prenatal and postpartum depression was evident in about 10% of men in the reviewed studies and was relatively higher in the 3- to 6-month postpartum period. Paternal depression also showed a moderate positive correlation with maternal depression.
11838334	Depressive symptoms occur frequently among patients with coronary artery disease (CAD), with prevalence estimates ranging from 15 to 30%. Risk ratios for first and recurrent cardiac events related to depression are comparable to well-established CAD risk factors and range from 2 to 7. The commonly atypical nature of depression in individuals with CAD plays an important role in the under diagnosis of depression in these patients. This review indicates that presence of atypical and subclinical depression, as well as of clinical major depressive disorders, significantly increase the risk of cardiac events. Pathophysiological mechanisms include altered autonomic nervous system activity, increased tendency toward blood coagulation, and elevated low-grade inflammation. Evidence suggests that depression in CAD patients does not reflect anatomical CAD severity or use of anti-ischemic medications. In addition to these pathophysiological pathways, depression affects CAD progression via adverse health behaviors such as smoking, poor compliance, and reduced exercise levels. Initial screening for depressive disorders can be accomplished using questionnaires, but structured clinical interview are preferred for definite diagnosis of depression. Optimal treatment of depression in CAD generally involves both psychological and pharmacological interventions that affect both depression and its biological correlates relevant to CAD progression.
10591380	Several interventions that modify well-documented and treatable cardiovascular and cerebrovascular risk factors can reduce the risk of a first stroke. Good evidence for direct stroke reduction exists for hypertension treatment; using warfarin for patients after MI who have atrial fibrillation, decreased left ventricular ejection fraction, or left ventricular thrombus; using 3-hydroxy-3 methylglutaryl coenzyme A (HMG-CoA) reductase inhibitors for patients after MI; using warfarin for patients with atrial fibrillation and specific risk factors; and performing carotid endarterectomy for patients with stenosis of at least 60%. Observational studies support the role of modifying lifestyle-related risk factors (eg, smoking, alcohol use, physical activity, diet) in stroke prevention. Measures to help patients improve adherence are an important component of a stroke prevention plan.
15936634	Approximately half of the patients participated in cardiac rehabilitation after MI. Participation did not increase over time. Women and elderly persons were less likely to participate, independently of other characteristics. Participation in rehabilitation was independently associated with decreased mortality and recurrent MI, and its protective effect was stronger in more recent years.
18464331	In at-risk patients with type 2 diabetes, intensive intervention with multiple drug combinations and behavior modification had sustained beneficial effects with respect to vascular complications and on rates of death from any cause and from cardiovascular causes. (ClinicalTrials.gov number, NCT00320008.)
17975861	These data support the use of anticoagulation therapy for people aged over 75 who have atrial fibrillation, unless there are contraindications or the patient decides that the benefits are not worth the inconvenience.
17502542	Profiling the quality of outpatient CAD care using data from an EHR has significant limitations. Changes in how data are routinely recorded in an EHR are needed to improve the accuracy of this type of quality measurement. Validity testing in different settings is required.
9798767	This meta-analysis used all original articles from 1966 to June 1996 that fit the preset inclusion criteria to examine the clinical effectiveness of intermittent pneumatic compression (IPC) devices in preventing deep vein thrombosis (DVT) and pulmonary embolism and to compare the results of knee-high sleeves to thigh-high sleeves. IPC devices decreased the relative risk of DVT by 62 per cent when compared with placebo, 47 per cent compared with graduated compression stockings, and 48 per cent compared with mini-dose heparin. IPC devices significantly decreased the relative risk of DVT compared with placebo in high-risk patients such as neurosurgery and major orthopedic surgery patients and in modest risk patients such as general surgery patients. In major orthopedic surgery patients, the incidence of DVT was similar for IPC- and warfarin-treated patients; however, IPC was significantly better than warfarin at decreasing the incidence of calf only DVT, whereas warfarin seemed to be better at decreasing proximal DVT. IPC devices are effective in decreasing the incidence of DVT in patients at moderate to high risk and are probably more efficacious than graduated compression stockings or mini-dose heparin; however, IPC devices are not protective against pulmonary embolism. The data directly comparing the various methods of compression (knee-high versus thigh-high sleeves and graded-sequential versus uniform compression) are sparse and conflicting.
