15051691	These data suggest that regular but not intermittent use of NSAIDs inhibits the clinical benefits of aspirin. Chance, bias, and confounding remain plausible alternative explanations, despite the prospective design and adjustment for covariates. Nonetheless, we believe the most plausible interpretation of the data to be that regular but not intermittent use of NSAIDs inhibits the clinical benefit of aspirin on first MI.
20451303	We present a map of 27 indicators to measure the care quality given to patients with acute coronary syndrome attended in the pre- and hospital area. This includes technical process indicators (registration of care intervals, performance of electrocardiogram, monitoring and vein access, assessment of prognostic risk, hemorrhage and in-hospital mortality, use of reperfusion techniques and performance of echocardiograph), pharmacological process indicators (platelet receptors inhibition, anticoagulation, thrombolysis, beta-blockers, angiotensin converting inhibitors and lipid lowering drugs) and outcomes indicators (quality scales of the care given and mortality).
12093424	It is concluded that depression predicts the development of CHD in initially healthy people. The stronger effect size for clinical depression compared to depressive mood points out that there might be a dose-response relationship between depression and CHD. Implications of the findings for a broader bio-psycho-social framework are discussed.
20930703	Arthritis is a large and growing public health problem in the United States, resulting in costs of $128 billion annually, and continues to be the most common cause of disability. With the aging of the U.S. population, even assuming that the prevalence of obesity and other risk factors remain unchanged, the prevalence of doctor-diagnosed arthritis and arthritis-attributable activity limitation (AAAL) is expected to increase significantly by 2030. To update previous U.S. estimates of doctor-diagnosed arthritis and AAAL, CDC analyzed National Health Interview Survey (NHIS) data from 2007--2009. This report summarizes the results of that analysis, which found that 22.2% (49.9 million) of adults aged 18 years had self-reported doctor-diagnosed arthritis, and 9.4% (21.1 million or 42.4% of those with arthritis) had AAAL. Among persons who are obese, an age-adjusted 33.8% of women and 25.2% of men reported doctor-diagnosed arthritis. Arthritis and AAAL represent a major public health problem in the United States that can be addressed, at least in part, by implementing proven obesity prevention strategies and increasing availability of effective physical activity programs and self-management education courses in local communities.
17236251	Depression seems to be an independent risk factor for the onset of a wide range of CVDs, although this evidence is related to a high level of heterogeneity.
15341453	Among patients who have recently had an acute coronary syndrome, an intensive lipid-lowering statin regimen provides greater protection against death or major cardiovascular events than does a standard regimen. These findings indicate that such patients benefit from early and continued lowering of LDL cholesterol to levels substantially below current target levels.
2109283	At post-mortem we examined heart tissue of (i) 31 patients with uraemia not on dialysis, (ii) 42 patients on haemodialysis for less than 6 months, (iii) 60 patients on haemodialysis for more than 6 months, (iv) 16 patients after renal transplantation, and (v) 11 patients on CAPD. Patients with stenosing coronary lesions were excluded. Diffuse non-coronary intermyocardiocytic fibrosis, assessed by a score system in trichrome-stained sections, was found in 91% of chronically uraemic patients, but not in non-hypertensive, non-diabetic controls. The lesion was present even in non-dialysed uraemic patients; in dialysed patients its severity was related to the duration of dialysis; it was demonstrable even years after renal transplantation. On electron-microscopy, collagen fibres were seen, while beta 2-M amyloid was consistently absent. Logistic regression analysis showed that uraemia was a determinant of intermyocardiocytic fibrosis independent of hypertension, diabetes mellitus, anaemia, heart weight, and presence or absence of dialysis procedure.
11375373	Patients with major depression and diabetes with or without evidence of heart disease have a higher number of CVD risk factors. Interventions aimed at decreasing these risk factors may need to address treatment for major depression in order to be effective.
19841889	Targeting more-intensive glucose lowering modestly reduced major macrovascular events and increased major hypoglycaemia over 4.4 years in persons with type 2 diabetes. The analyses suggest that glucose-lowering regimens should be tailored to the individual.
10231228	The relationship between brain damage and high temperature is greater the earlier the increase in temperature occurs. However, only body temperature within the first 24 hours from stroke onset is associated with poor outcome and large cerebral infarcts.
9667723	A superiority of LMWH is suggested but heterogeneity might make generalizability to future patients questionable. A meta-analysis on individual patient data should be the next step before randomizing additional patients in future trials.
8446152	In patients with asymptomatic left ventricular dysfunction after myocardial infarction, long-term administration of captopril was associated with an improvement in survival and reduced morbidity and mortality due to major cardiovascular events. These benefits were observed in patients who received thrombolytic therapy, aspirin, or beta-blockers, as well as those who did not, suggesting that treatment with captopril leads to additional improvement in outcome among selected survivors of myocardial infarction.
15523309	Stratification of patients after acute MI by a simple measure of MI size identifies populations with different long-term prognoses; patients with a QRS score > or =10 (approximately 30% of the left ventricle infarcted) at discharge have poorer outcomes in both the short- and long-term. The standard 12-lead ECG provides a simple, economical means of risk stratification at discharge.
9259673	There are two major trials of aspirin in acute ischaemic stroke. Taken together, CAST and the similarly large IST show reliably that aspirin started early in hospital produces a small but definite net benefit, with about 9 (SD 3) fewer deaths or non-fatal strokes per 1000 in the first few weeks (2p = 0.001), and with 13 (5) fewer dead or dependent per 1000 after some weeks or months of follow-up (2p < 0.01).
10680099	There is a significant trend in the attendance and completion of CR programs by older individuals, which suggests a greater awareness of patients and their physicians. The growth of the program is fueled by high-risk patients with more comorbidities who potentially are the group of patients able to obtain the greatest absolute benefit from CR.
7458515	Signs consistent with the propranolol withdrawal rebound syndrome may occur when propranolol hydrochloride administration is temporarily discontinued because of major noncardiac surgical procedures. The time course of the appearance of these signs indicates that the risk of the propranolol withdrawal rebound syndrome peaks about four to seven days after drug discontinuation. Continuation of propranolol up to the time of surgery appears safe from an anesthetic standpoint and may also help to postpone the risk of the withdrawal rebound syndrome until after oral propranolol therapy can be reinstituted.
11386271	The previously reported benefits of carvedilol with regard to morbidity and mortality in patients with mild-to-moderate heart failure were also apparent in the patients with severe heart failure who were evaluated in this trial.
11113218	If the NINDS rt-PA Stroke Trial treatment protocol is followed, this analysis suggests that patients treated 0 to 90 minutes from stroke onset with rt-PA have an increased odds of improvement at 24 hours and favorable 3-month outcome compared to patients treated later than 90 minutes. No effect of OTT on intracranial hemorrhage was detected within the group treated with rt-PA, possibly due to low power.
1557097	The addition of enalapril to conventional therapy significantly reduced mortality and hospitalizations for heart failure in patients with chronic congestive heart failure and reduced ejection fractions.
17368146	These data confirm that intravenous alteplase is safe and effective in routine clinical use when used within 3 h of stroke onset, even by centres with little previous experience of thrombolytic therapy for acute stroke. The findings should encourage wider use of thrombolytic therapy for suitable patients treated in stroke centres.
17403800	These large projected increases in demand for total hip and knee arthroplasties provide a quantitative basis for future policy decisions related to the numbers of orthopaedic surgeons needed to perform these procedures and the deployment of appropriate resources to serve this need.
19352314	clinicaltrials.gov Identifier: NCT00110448.
10809041	Depression is common following an episode of unstable angina and is associated with an increased risk of major cardiac events during the following year.
17000937	Coaching chronically ill older patients and their caregivers to ensure that their needs are met during care transitions may reduce the rates of subsequent rehospitalization.
8126524	A formal statistical overview of all truly randomised trials was undertaken to determine whether antithrombotic therapy is effective and safe in the early treatment of patients with acute stroke. There were 15 completed randomised controlled trials of the value of early antithrombotic treatment in patients with acute stroke. The regimes tested in acute presumed or confirmed ischaemic stroke were: heparin, 10 trials with 1047 patients: oral anticoagulants, one trial with 51 patients: antiplatelet therapy, three trials with 103 patients. Heparin was tested in one trial with 46 patients with acute haemorrhagic stroke. Outcome measures were deep venous thrombosis (confirmed by I125 scanning or venography), pulmonary embolism, death from all causes, haemorrhagic transformation of cerebral infarction, level of disability in survivors. In patients with acute ischaemic stroke, allocation to heparin was associated with a highly significant 81% (SD 8, 2p < 0.00001) reduction in deep venous thrombosis detected by I125 fibrinogen scanning or venogram. Only three trials systematically identified pulmonary emboli, which occurred in 6/106 (5.7%) allocated control vs 3/132 (2.3%) allocated heparin, a non-significant 58% reduction (SD 45.7, 2p > 0.1). There were relatively few deaths in the trials in patients with presumed ischaemic stroke: 94/485 (19.4%) among patients allocated to the control group vs 79/497 (15.9%) among patients who were allocated heparin. The observed 18% (SD 16) reduction in the odds of death was not statistically significant. The least biased estimated of the effect of treatment on haemorrhagic transformation of the cerebral infarct (HTI) comes from trials where all patients were scanned at the end of treatment, irrespective of clinical deterioration; using this analysis, haemorrhagic transformation occurred in 7/102 (6.9%) control vs 8/106 (7.5%) treated, a non-significant 12% increase (SD 56, 2p > 0.1). These data cannot exclude the possibility that heparin substantially increases the risks of HTI. No data on disability in survivors could be obtained. Early heparin treatment might be associated with substantial reductions in deep venous thrombosis (and probably also pulmonary embolism) and possibly a one fifth reduction in mortality (equivalent to the avoidance of 20-40 early deaths per thousand patients treated.) However, the data were wholly inadequate on safety, particularly on the risk of haemorrhagic transformation of the infarct and on the hazards of heparin therapy in patients with known intracerebral haemorrhage. The trials of oral anticoagulants (15 deaths among 57 patients) and antiplatelet therapy (two deaths among 103 patients) were too small to be informative. Much larger randomized trials-comparing aspirin, heparin and the combination of both drugs against control-in patients with acute ischaemic stroke are justified (and several are now planned or underway).
15614334	Between 53.1% and 67.5% of patients presenting for cardiac catheterization undergo revascularization within one year. Urgent status increased the probability of PCI, and anatomy (ie, three-vessel and left main) increased the probability of CABG. Patients not undergoing proposed revascularization by one year had poorer outcomes, in contrast with those proposed for medical therapy, who had excellent outcomes.
18574265	This article concerning the pharmacokinetics and pharmacodynamics of vitamin K antagonists (VKAs) is part of the American College of Chest Physicians Evidence-Based Clinical Practice Guidelines (8th Edition). It describes the antithrombotic effect of the VKAs, the monitoring of anticoagulation intensity, and the clinical applications of VKA therapy and provides specific management recommendations. Grade 1 recommendations are strong and indicate that the benefits do or do not outweigh the risks, burdens, and costs. Grade 2 recommendations suggest that the individual patient's values may lead to different choices. (For a full understanding of the grading, see the "Grades of Recommendation" chapter by Guyatt et al, CHEST 2008; 133:123S-131S.) Among the key recommendations in this article are the following: for dosing of VKAs, we recommend the initiation of oral anticoagulation therapy, with doses between 5 mg and 10 mg for the first 1 or 2 days for most individuals, with subsequent dosing based on the international normalized ratio (INR) response (Grade 1B); we suggest against pharmacogenetic-based dosing until randomized data indicate that it is beneficial (Grade 2C); and in elderly and other patient subgroups who are debilitated or malnourished, we recommend a starting dose of < or = 5 mg (Grade 1C). The article also includes several specific recommendations for the management of patients with nontherapeutic INRs, with INRs above the therapeutic range, and with bleeding whether the INR is therapeutic or elevated. For the use of vitamin K to reverse a mildly elevated INR, we recommend oral rather than subcutaneous administration (Grade 1A). For patients with life-threatening bleeding or intracranial hemorrhage, we recommend the use of prothrombin complex concentrates or recombinant factor VIIa to immediately reverse the INR (Grade 1C). For most patients who have a lupus inhibitor, we recommend a therapeutic target INR of 2.5 (range, 2.0 to 3.0) [Grade 1A]. We recommend that physicians who manage oral anticoagulation therapy do so in a systematic and coordinated fashion, incorporating patient education, systematic INR testing, tracking, follow-up, and good patient communication of results and dose adjustments [Grade 1B]. In patients who are suitably selected and trained, patient self-testing or patient self-management of dosing are effective alternative treatment models that result in improved quality of anticoagulation management, with greater time in the therapeutic range and fewer adverse events. Patient self-monitoring or self-management, however, is a choice made by patients and physicians that depends on many factors. We suggest that such therapeutic management be implemented where suitable (Grade 2B).
8176099	Metoprolol improved hemodynamic status in patients with dilated cardiomyopathy at rest and had a more pronounced effect during exercise. These positive effects were achieved along with improved or stable myocardial metabolic data.
15383482	This chapter about treatment and prevention of stroke is part of the 7th ACCP Conference on Antithrombotic and Thrombolytic Therapy: Evidence Based Guidelines. Grade 1 recommendations are strong and indicate that the benefits do, or do not, outweigh risks, burden, and costs. Grade 2 suggests that individual patients' values may lead to different choices (for a full understanding of the grading see Guyatt et al). Among the key recommendations in this chapter are the following: For patients with acute ischemic stroke (AIS), we recommend administration of i.v. tissue plasminogen activator (tPA), if treatment is initiated within 3 h of clearly defined symptom onset (Grade 1A). For patients with extensive and clearly identifiable hypodensity on CT, we recommend against thrombolytic therapy (Grade 1B). For unselected patients with AIS of > 3 h but < 6 h, we suggest clinicians not use i.v. tPA (Grade 2A). For patients with AIS, we recommend against streptokinase (Grade 1A) and suggest clinicians not use full-dose anticoagulation with i.v. or subcutaneous heparins or heparinoids (Grade 2B). For patients with AIS who are not receiving thrombolysis, we recommend early aspirin therapy, 160 to 325 mg qd (Grade 1A). For AIS patients with restricted mobility, we recommend prophylactic low-dose subcutaneous heparin or low molecular weight heparins or heparinoids (Grade 1A); and for patients who have contraindications to anticoagulants, we recommend use of intermittent pneumatic compression devices or elastic stockings (Grade 1C). In patients with acute intracerebral hematoma, we recommend the initial use of intermittent pneumatic compression (Grade 1C+). In patients with noncardioembolic stroke or transient ischemic attack (TIA) [ie, atherothrombotic, lacunar or cryptogenic], we recommend treatment with an antiplatelet agent (Grade 1A) including aspirin, 50 to 325 mg qd; the combination of aspirin and extended-release dipyridamole, 25 mg/200 mg bid; or clopidogrel, 75 mg qd. In these patients, we suggest use of the combination of aspirin and extended-release dipyridamole, 25/200 mg bid, over aspirin (Grade 2A) and clopidogrel over aspirin (Grade 2B). For patients who are allergic to aspirin, we recommend clopidogrel (Grade 1C+). In patients with atrial fibrillation and a recent stroke or TIA, we recommend long-term oral anticoagulation (target international normalized ratio, 2.5; range, 2.0 to 3.0) [Grade 1A]. In patients with venous sinus thrombosis, we recommend unfractionated heparin (Grade 1B) or low molecular weight heparin (Grade 1B) over no anticoagulant therapy during the acute phase.
15383483	This chapter about antithrombotic therapy for coronary artery disease (CAD) is part of the Seventh ACCP Conference on Antithrombotic and Thrombolytic Therapy: Evidence Based Guidelines. Grade 1 recommendations are strong and indicate that the benefits do, or do not, outweigh risks, burden, and costs. Grade 2 suggests that individual patients' values may lead to different choices (for a full understanding of the grading see Guyatt et al, CHEST 2004; 126:179S-187S). Among the key recommendations in this chapter are the following: For patients presenting with non-ST-segment elevation (NSTE) acute coronary syndrome (ACS), we recommend immediate and then daily oral aspirin (Grade 1A). For patients with an aspirin allergy, we recommend immediate treatment with clopidogrel, 300-mg bolus po, followed by 75 mg/d indefinitely (Grade 1A). In all NSTE ACS patients in whom diagnostic catheterization will be delayed or when coronary bypass surgery will not occur until > 5 days, we recommend clopidogrel as bolus therapy (300 mg), followed by 75 mg/d for 9 to 12 months in addition to aspirin (Grade 1A). In NSTE ACS patients in whom angiography will take place within 24 h, we suggest beginning clopidogrel after the coronary anatomy has been determined (Grade 2A). For patients who have received clopidogrel and are scheduled for coronary bypass surgery, we recommend discontinuing clopidogrel for 5 days prior to the scheduled surgery (Grade 2A). In moderate- to high-risk patients presenting with NSTE ACS, we recommend either eptifibatide or tirofiban for initial (early) treatment in addition to treatment with aspirin and heparin (Grade 1A). For the acute treatment of NSTE ACS, we recommend low molecular weight heparins over unfractionated heparin (UFH) [Grade 1B] and UFH over no heparin therapy use with antiplatelet therapies (Grade 1A). We recommend against the direct thrombin inhibitors as routine initial antithrombin therapy (Grade 1B). For patients after myocardial infarction, after ACS, and with stable CAD, we recommend aspirin in doses from 75 to 325 mg as initial therapy and in doses of 75 to 162 mg as indefinite therapy (Grade 1A). For patients with contraindications to aspirin, we recommend long-term clopidogrel (Grade 1A). For primary prevention in patients with at least moderate risk for a coronary event, we recommend aspirin, 75 to 162 mg/d, over either no antithrombotic therapy or vitamin K antagonist (VKA) [Grade 2A]; for patients at particularly high risk of events in whom the international normalized ratio (INR) can be monitored without difficulty, we suggest low-dose VKA (target INR, 1.5) [Grade 2A].
19841446	Medical Research Council (UK), Chief Scientist Office of Scottish Government, Chest Heart and Stroke Scotland, Tyco Healthcare (Covidien) USA, and UK Stroke Research Network.
9074574	About 60% of patients with a first episode of proximal deep-vein thrombosis develop post-thrombotic syndrome within 2 years. A sized-to-fit compression stocking reduced this rate by about 50%.
17630453	The Hospital Quality Alliance (HQA) program gives us the opportunity to systematically monitor the quality of hospital care nationwide. To gauge the importance of the HQA indicators, we examined the relationship between hospitals' performance on HQA quality indicators and mortality for Medicare enrollees admitted for acute myocardial infarction, congestive heart failure, and pneumonia. We found that higher condition-specific performance on this national quality reporting program is associated with lower risk-adjusted mortality for each of the three conditions. The relationship between high HQA performance and lower risk-adjusted mortality is an important validation for this national hospital quality rating program.
24469880	Increasing the dose of ASA from 75 mg to 150 mg daily or switching ASA 75 mg to clopidogrel 75 mg daily may reduce concentrations of some inflammatory markers (in particular hsCRP, IL-6 and CD40L) in T2DM patients with HPR treated previously with 75 mg of ASA.
14726552	High and low SBP and DBP, as well as a relevant drop in BP, are associated with poor prognosis in patients with ischemic stroke.
19748391	UK Medical Research Council, British Heart Foundation, Cancer Research UK, and the European Community Biomed Programme.
10886481	Screening nonfasting adults for total and HDL cholesterol is appropriate for making decisions about primary prevention of coronary heart disease.
19244191	Prepregnancy or gestational diabetes was independently associated with perinatal depression, including new onset of postpartum depression, in our sample of low-income new mothers.
4918519	We performed a comprehensive review of the literature to determine whether or not a relationship between depression and coronary artery disease exists. Our literature search supports the following: Depression and coronary artery disease have a bidirectional relationship, i.e., coronary artery disease can cause depression and depression is an independent risk factor for coronary artery disease and its complications; depression may contribute to sudden cardiac death and increase all causes of cardiac mortality; and depression contributes to unhealthy lifestyle and poor adherence to treatment. We review various pathophysiological links between depression and coronary artery disease and screening for depression in at-risk patients for coronary artery disease. We also discuss pharmacological treatments, their implications, and various behavioral treatments.
