8269101	The relationship between a hypercoagulable state and intracardiac thrombus formation is reviewed, with reference to the pathophysiology of intracardiac thrombus in patients with acute cardioembolic stroke, and those with mitral stenosis. When the development or enlargement of intracardiac thrombus is followed serially by echocardiography, the diameter of the inferior vena cava is seen to decrease as the hematocrit increases, particularly in patients with negative water balance taking diuretics. These findings strongly suggest that dehydration could play an important role in the formation of thrombus. A hypercoagulable and secondarily enhanced fibrinolytic state exists in the cardiac chamber of patients with acute cardioembolic stroke or with intracardiac thrombus. This can be evaluated by plasma levels of fibrinopeptide A, fibrinopeptide B beta 15-42, thrombin-antithrombin III complex and D-dimer. Anticoagulant treatment suppresses thrombin activity in the cardiac chamber, allowing plasma fibrinolytic activity to predominate and reduce the size of the intracardiac thrombus.
1892330	Prophylaxis for venous thromboemobolism is underused, particularly in nonteaching hospitals.
21734636	Continued declines in incidence and mortality are expected as past and current public health emphasis on the importance of CRC screening become evident with the increase in screening. To ensure these gains continue, CRC screening should be accessible and used as recommended by all eligible persons in the United States.
12021694	Prophylactic CS and Ed in patients with prior venous stasis ulceration are cost saving, even with the most conservative of assumptions. Insurers should routinely reimburse for these interventions.
20947855	Planned collaborations between stroke researchers to conduct trials with common protocols and outcome measures can help advance rehabilitation science. VEM was associated with improved independence at 3 months compared with standard care. However, both trials are limited by small sample sizes. Larger trials (such as AVERT phase III) are still needed in this field.
19033164	Depression and anxiety were strongly associated with common chronic medical disorders and adverse health behaviors. Examination of mental health should therefore be an integral component of overall health care.
14674380	Our results suggest that carvedilol extends survival compared with metoprolol.
17872477	Management of patients with acute ischemic stroke remains multifaceted and includes several aspects of care that have not been tested in clinical trials. This statement includes recommendations for management from the first contact by emergency medical services personnel through initial admission to the hospital. Intravenous administration of recombinant tissue plasminogen activator remains the most beneficial proven intervention for emergency treatment of stroke. Several interventions, including intra-arterial administration of thrombolytic agents and mechanical interventions, show promise. Because many of the recommendations are based on limited data, additional research on treatment of acute ischemic stroke is needed.
23032469	Strong recommendations apply to most patients, whereas weak recommendations are sensitive to differences among patients, including their preferences.
15266423	All of the commercially available forms of NRT (gum, transdermal patch, nasal spray, inhaler and sublingual tablets/lozenges) can help people who make a quit attempt to increase their chances of successfully stopping smoking. NRTs increase the rate of quitting by 50-70%, regardless of setting. The effectiveness of NRT appears to be largely independent of the intensity of additional support provided to the individual. Provision of more intense levels of support, although beneficial in facilitating the likelihood of quitting, is not essential to the success of NRT.
3052345	Favored strategies for diagnosis of first DVT combine use of pretest probability assessment, D-dimer, and US. There is lower-quality evidence available to guide diagnosis of recurrent DVT, upper extremity DVT, and DVT during pregnancy.
15121495	After myocardial infarction, a large proportion of patients discontinue use of medications over time. Enrollment in cardiac rehabilitation after myocardial infarction is associated with improved medication adherence.
18216632	We identified numerous issues related to study design, conduct, and quality that dispute the validity and question any inferences that can be drawn from these trials. In the context of these limitations, the initial RRT modality did not seem to affect mortality or recovery to RRT independence. There is urgent need for additional high-quality and suitably powered trials to adequately address this issue.
23011717	Increases in TKA volume have been driven by both increases in the number of Medicare enrollees and in per capita utilization. We also observed decreases in hospital LOS that were accompanied by increases in hospital readmission rates.
19896240	These recommendations are designed to be of assistance to doctors in ICUs when making first evaluations of these patients. They are mainly intended to assist with early diagnosis, risk stratification and initial treatment. The need for individualised treatment is at present one of the main objectives in the management of Acute Coronary Syndrome (ACS), with or without ST elevation, and this is why we believe the recommendations should be of a predominantly practical nature, given that they affect decision making in the day to day practice of medicine.
17765050	In patients following major coronary events, cardiac rehabilitation is associated with both reductions in depressive symptoms and the excess mortality associated with it. Moreover, only mild improvements in levels of fitness appear to be needed to produce these benefits on depressive symptoms and its associated mortality.
11742929	One of six cases of all VTE and two of three cases of VTE for which thromboprophylaxis had been indicated could potentially have been prevented had physicians followed the recommended ACCP guidelines. Inadequacy of prophylaxis was most often caused by omission of prophylaxis. Missed opportunities for prevention occurred most commonly in the settings of nonorthopedic surgery, pneumonia, and stroke.
15381522	Pending confirmation from large, ongoing clinical trials, this analysis shows that observational studies are consistent with limited clinical trial data and suggests that chronic hyperglycemia is associated with an increased risk for cardiovascular disease in persons with diabetes.
12028227	Our meta-analysis indicates that reduction in LDL-C associated with statin drug treatment decreases the risk of coronary heart disease and all-cause mortality. The risk reduction was similar for men and women and for elderly and middle-aged persons.
8408712	Computer based programs can assist outpatient anticoagulant control with warfarin during both early and long term treatment. For most patients the control achieved is as good as that obtained by the customary method of dosing, by experienced clinic doctors, although the latter tend to be too conservative when dosing patients within the intense target range of 3.0 to 4.5 International Normalised Ratio (INR). The computers were significantly more successful in this higher range.
17906263	People with severe mental illness treated with antipsychotics have excess metabolic dysfunction and heightened risk for cardiovascular disease.
19170587	Thromboembolic disorders such as deep vein thrombosis, pulmonary embolism, myocardial infarction, and stroke often result in long-term disability and/or mortality. The anticoagulants currently available have been effective in the treatment and prevention of these disorders; however, parenteral administration, variable pharmacokinetics and pharmacodynamics, drug and dietary interactions, and a requirement for frequent monitoring of efficacy and safety limit use of these drugs. Rivaroxaban is a novel, oral factor Xa inhibitor in clinical development for the treatment and prevention of thromboembolic diseases. Rivaroxaban is a small molecule directed at active sites, and the agent mechanistically differs from traditional anticoagulants, such as heparins and fondaparinux, in that its activity is independent of antithrombin and its ability to inhibit prothrombinase bound factor Xa. In addition, preclinical and clinical trial data indicate that rivaroxaban has predictable pharmacokinetics and pharmacodynamics, which are features that differentiate it from oral vitamin K antagonists. Phase II studies showed that rivaroxaban is safe and well tolerated across a wide range of doses. Furthermore, completed phase III studies demonstrated its efficacy in the prevention of venous thromboembolism after orthopedic surgery. Additional studies are now under way to evaluate the use of rivaroxaban in the treatment and prevention of other venous and arterial thromboembolic conditions.
11213249	Stroke is a common problem, producing a variety of neurological problems that affect eating. Dysphagia is a particular concern because of its potential for airway obstruction, malnutrition, and aspiration pneumonia. With chest infection reported in up to 32% of stroke patients, this is a major clinical issue. The following research questions are raised: (1) What are the incidence and outcomes of dysphagia and aspiration in acute stroke? (2) What screening interventions are available to detect dysphagia in patients with acute stroke and what effect have they on patient outcomes? A systematic review was carried out using methods and quality criteria of the NHS Centre for Reviews and Dissemination (1996), focusing on studies of adults with acute stroke. Data were extracted, collated, and presented descriptively. Two hundred forty-eight articles were retrieved with 26 meeting inclusion and quality criteria. Clinical dysphagia is common, associated with a range of deleterious outcomes and clearly linked to development of chest infection. Interpretation of aspiration on videofluoroscopy is not as straightforward but probably also confers additional risk. Further work is required on the relationship between aspiration and pneumonia, and pneumonia prevention. This will include exploration of the effects of screening, and the further development and validation of screening methods. While studies indicate current "best practice," in this important area of patient care further work is urgently required.
12801765	The reductions in major cardiovascular events with atorvastatin are large, given the short follow-up time. These findings may have implications for future lipid-lowering guidelines.
11209161	Our simulation indicates that increased use of beta-blockers after MI would lead to impressive gains in health and would be potentially cost saving. JAMA. 2000;284:2748-2754.
14596714	OBJECTIVES: This study was designed to assess the prevalence and persistence of symptoms of depression and anxiety during the first 12 months following acute myocardial infarction (MI). DESIGN AND METHODS: In a prospective study, 288 MI patients were assessed for symptoms of depression and anxiety using the Beck Depression Inventory (BDI) and the State-Trait Anxiety Inventory (STAI) in hospital, 2-15 days following MI, and 4 and 12 months subsequently. RESULTS: During hospitalization, 89 (30.9%) and 75 (26.1%) patients registered elevated BDI scores (>/=10) and state anxiety scores (>/=40), respectively. The 4 and 12 month prevalence rates were 37.7% and 37.2% for depressive symptoms, and 41.8% and 40.0% for anxious symptoms, respectively. Depression and anxiety were highly co-morbid, with 51% of patients experiencing significant levels of depressive and anxious symptoms at baseline. More than half the patients with complete BDI and state anxiety data experienced either elevated symptoms of anxiety or depression throughout the first year following MI. CONCLUSIONS: Symptoms of depression and anxiety are prevalent, persistent problems during the first year following MI. This study highlights the importance of routine psychological assessment for MI patients both in hospital and after discharge.
16585666	Heart failure is a clinical syndrome that normally requires health care to be provided by both specialists and nonspecialists. This is advantageous because patients benefit from complementary skill sets and experience, but can present challenges in the development of a common, shared treatment plan. The Canadian Cardiovascular Society published a comprehensive set of recommendations on the diagnosis and management of heart failure in January 2006, and on the prevention, management during intercurrent illness or acute decompensation, and use of biomarkers in January 2007. The present update builds on those core recommendations. Based on feedback obtained through a national program of heart failure workshops during 2006 and 2007, several topics were identified as priorities because of the challenges they pose to health care professionals. New evidence-based recommendations were developed using the structured approach for the review and assessment of evidence that was adopted and previously described by the Society. Specific recommendations and practical tips were written for best practices during the transition of care of heart failure patients, and the recognition, investigation and treatment of some specific cardiomyopathies. Specific clinical questions that are addressed include: What information should a referring physician provide for a specialist consultation? What instructions should a consultant provide to the referring physician? What processes should be in place to ensure that the expectations and needs of each physician are met? When a cardiomyopathy is suspected, how can it be recognized, how should it be investigated and diagnosed, how should it be treated, when should the patient be referred, and what special tests are available to assist in the diagnosis and treatment? The goals of the present update are to translate best evidence into practice, apply clinical wisdom where evidence for specific strategies is weaker, and aid physicians and other health care providers to optimally treat heart failure patients, resulting in a measurable impact on patient health and clinical outcomes in Canada.
19461022	There is a strong association of high systolic BP after thrombolysis with poor outcome. Withholding antihypertensive therapy up to 7 days in patients with a history of hypertension was associated with worse outcome, whereas initiation of antihypertensive therapy in newly recognized moderate hypertension was associated with a favorable outcome.
2057006	We have investigated the prevalence of gastrointestinal (GI) symptoms in 98 individuals with Parkinson's disease (PD) and in a control group of 50. Seventy-nine of those with PD were being treated with dopaminergic medications and 19 were untreated. Those symptoms occurring more frequently in PD patients than in controls included abnormal salivation, dysphagia, nausea, constipation, and defecatory dysfunction. Except for defecatory dysfunction, symptoms did not correlate with treatment but instead correlated with disease severity. This suggests that the GI symptoms of PD reflect direct involvement in the GI tract by the primary disease process.
9932944	During acute ischemic stroke hyperglycemia may worsen the clinical outcome in nonlacunar stroke, but not in lacunar stroke, and is not associated with an increased risk of hemorrhagic transformation of the infarct.
22187273	Depression is associated with a significantly increased risk of stroke morbidity and mortality.
15495007	Fixed dose LMWH is more effective and safer than adjusted dose UFH for the initial treatment of VTE. Compared to UFH, LMWH significantly reduced the incidence of thrombotic complications, the occurrence of major haemorrhage during initial treatment and overall mortality at follow up.
15674871	Calcium antagonists reduce the risk of poor outcome and secondary ischaemia after aneurysmal SAH. The results for 'poor outcome' depend largely on a single large trial of oral nimodipine; the evidence for other calcium antagonists is inconclusive. The evidence for nimodipine is not beyond all doubt, but given the potential benefits and modest risks of this treatment, oral nimodipine is currently indicated in patients with aneurysmal SAH. Intravenous administration of calcium antagonists cannot be recommended for routine practice on the basis of the present evidence. Magnesium sulphate is a promising agent but more evidence is needed before definite conclusions can be drawn.
23414649	NIHR Health Technology Assessment Programme, NIHR Biomedical Research Centres funding scheme, Cancer Research UK, EPSRC Multidisciplinary Assessment of Technology Centre for Healthcare, and NIHR Collaborations for Leadership in Applied Health Research and Care.
10407688	Pulmonary embolism occurs in more than 175,000 patients each year in the United States. The objectives of treatment are to prevent death from the existing embolus, to prevent death and morbidity from recurrent pulmonary embolism, and to prevent morbidity from recurrent deep-vein thrombosis. For patients with adequate cardiorespiratory reserve, the primary objective is to prevent recurrent pulmonary embolism. Anticoagulant therapy with intravenous unfractionated heparin or subcutaneous low molecular weight heparin followed by oral anticoagulant treatment for at least 3 months is the treatment of choice for most of these patients. Clinical trials indicate that the effectiveness of intravenous heparin depends on achieving an adequate heparin effect (activated partial thromboplastin time above lower limit) during the initial 24 hours. A validated protocol for intravenous heparin should be used to lessen the likelihood of delayed heparinization. Low molecular weight heparin given subcutaneously either once or twice daily is as effective as intravenous heparin for the treatment of patients with deep-vein thrombosis and submassive pulmonary embolism. Low molecular weight heparin enables many patients with uncomplicated deep-vein thrombosis to be treated in an outpatient setting.
12411640	Both high blood pressure and low blood pressure were independent prognostic factors for poor outcome, relationships that appear to be mediated in part by increased rates of early recurrence and death resulting from presumed cerebral edema in patients with high blood pressure and increased coronary heart disease events in those with low blood pressure. The occurrence of symptomatic intracranial hemorrhage within 14 days was independent of SBP.
15668354	This article updates the 1994 American Heart Association scientific statement on cardiac rehabilitation. It provides a review of recommended components for an effective cardiac rehabilitation/secondary prevention program, alternative ways to deliver these services, recommended future research directions, and the rationale for each component of the rehabilitation/secondary prevention program, with emphasis on the exercise training component.
16103248	Total door-to-balloon times for transfer patients undergoing primary PCI in the United States rarely achieve guideline-recommended benchmarks, and current decision making should take these times into account. For the full benefits of primary PCI to be realized in transfer patients, improved systems are urgently needed to minimize total door-to-balloon times.
20633738	The PHQ-9, GAD-7 and PHQ-15 are brief well-validated measures for detecting and monitoring depression, anxiety and somatization.
10591390	This study found no significant rt-PA benefit on the 90-day efficacy end points in patients treated between 3 and 5 hours. The risk of symptomatic ICH increased with rt-PA treatment. These results do not support the use of intravenous rt-PA for stroke treatment beyond 3 hours.
20842753	From the caregiver perspective, lack of knowledge and low self-efficacy play a larger role than practical barriers in compliance with annual TCDs. Ongoing education at multiple patient encounters and encouragement of caregivers' empowerment and role in obtaining annual screenings may increase TCD compliance.
10089714	We investigated the effects of antihypertensive treatment on left ventricular hypertrophy (LVH) of long-term hemodialysis patients. In uremic patients, it is still controversial in antihypertensive effect to the regression of LVH. The left ventricular size and function of 39 uremic hypertensive long-term hemodialysis patients (27 men, 12 women, mean age 58.3) was evaluated with M-mode, 2-dimensional and Doppler echocardiography before, and 12 months after, the start of combined antihypertensive therapy. This therapy included angiotensin II converting enzyme inhibitors, beta-blockers and calcium antagonists. Patients were classified as responders or nonresponders, depending upon whether their systolic blood pressure (SBP) decreased by more than 10 mmHg after antihypertensive treatment for 12 months. Before treatment, 36 (92%) patients had LVH and diastolic dysfunction and three (8%) had systolic dysfunction. At the end of 12 months, only 25 (64%) patients had LVH, 30 (77%) had diastolic dysfunction and 2 (5%) had systolic dysfunction. Left ventricular mass index (LVMI) also decreased from 203.63 +/- 70.47 g/m2 to 178.57 +/- 67.31 g/m2. LVMI correlated with systolic blood pressure (SBP) but did not correlate with diastolic blood pressure (DBP). There were 26 responders and 13 non-responders. Among responders, both the SBP (153.91 +/- 13.24 mmHg vs 134.43 +/- 14.21 mmHg, p < 0.01) and DBP (90.39 +/- 7.89 mmHg vs 79.98 +/- 7.35 mmHg, p < 0.01) decreased significantly after antihypertensive therapy. Responders also exhibited progressive regression of LVH (LVMI decreased significantly from 208.52 +/- 72.03 g/m2 to 168.52 +/- 55.53 g/m2, p < 0.05). However, LVH regression was not found in nonresponders (LVMI showed 194.84 +/- 64.36 g/m2 vs 193.66 +/- 77.67 g/m2). We conclude that good control of blood pressure can reverse LVH in hypertensive hemodialysis patients.
19279509	It is possible to use electronic health record data to devise hypertension measures that may better reflect who has actionable uncontrolled blood pressure, do not penalize clinicians treating resistant hypertension patients, reduce the encouragement of potentially unsafe practices, and identify patients possibly receiving poor care with no hypertension diagnosis. This could improve the detection of true quality problems and remove incentives to over treat or stop caring for patients with resistant hypertension.
23152231	The available evidence for ADP receptor antagonists in patients with diabetes mellitus is limited and most trials do not report outcomes for patients with diabetes separately. Therefore, recommendations for the use of ADP receptor antagonists for the prevention of CVD in patients with diabetes are based on available evidence from trials including patients with and without diabetes. Trials with diabetes patients and subgroup analyses of patients with diabetes in trials with combined populations are needed to provide a more robust evidence base to guide clinical management in patients with diabetes.
10927730	Low-molecular-weight and unfractionated heparin have been shown to be effective for prophylaxis of venous thromboembolism in elective neurosurgery without excessive bleeding risk.
15494780	The treatment decision to revascularize the coronary vessels, whether with PCI with or without a stent or with CABG, was consistently associated with significantly better HRQOL at one-year follow-up compared with patients treated with medical therapy.
11375373	The presence of diabetes doubles the odds of comorbid depression. Prevalence estimates are affected by several clinical and methodological variables that do not affect the stability of the ORs.
2236726	Patients with a stable progression of chronic renal failure with a creatinine clearance of 15-45 mL/min were randomly assigned to two groups of antihypertensive therapy: 1--nisoldipine as the only antihypertensive agent and 2--antihypertensive drugs without calcium channel blockers and a placebo tablet instead of nisoldipine. The patients were already on a low-protein diet and some form of antihypertensive therapy but without calcium channel blockers. There were 18 patients in the placebo group and 20 patients in the nisoldipine group. The follow-up period averaged 23.7 +/- 10.6 (SD) months in the placebo group and 23 +/- 11.3 months in the nisoldipine group. The slopes of the reciprocal of serum creatinine were calculated for the period prior to and following our intervention. The number of patients whose slopes improved following intervention was 6/18 in the placebo group and 15/20 in the nisoldipine group (p less than .02). The patients whose slopes improved had a significant fall in systolic and diastolic BP, as well as in the MAP. Those whose slopes did not improve had a significant decrease in systolic BP, but no change in diastolic BP and no significant difference in the MAP. When all 38 patients are analyzed together, regardless of their grouping, the correlation between the difference percent in the slope, and the difference percent in the MAP, was significant. Furthermore, punch biopsies of the skin showed a markedly different calcium content in the two groups, which was significantly less in the nisoldipine-treated patients as compared with the patients not receiving calcium blockers.(ABSTRACT TRUNCATED AT 250 WORDS)
9337224	The incidence of AF in older adults may be higher than estimated by previous population studies. Left atrial size appears to be an important risk factor, and the control of blood pressure and glucose may be important in preventing the development of AF.
