15656708	Nearly 10% of CSHCN had experienced delayed or forgone health care in the past 12 months in 2001. Logistic regression showed that delayed or forgone care was more likely to be reported by the families of CSHCN who were adolescents, who had more severe limitations, lived in the South or West, lacked medical insurance, and who lived in families under or near the federal poverty line. Hispanics were more likely to report "lack of medical specialty" and "had language, communication, or cultural problems with provider." Both Hispanics and non-Hispanic others were twice as likely to report "provider not accessible" as reasons for the delayed or forgone care compared with non-Hispanic whites or blacks. conclusion: CSHCN with certain socioeconomic status and sociodemographic characteristics, as well as those with severe limitations in activity, were more likely to be affected by circumstances that result in delayed or forgone care.
9559090	The purpose of this study was to determine the prevalence of dental caries and the use of dental services in a pediatric population of Mexican-American migrant workers. The results were compared with the Mexican-American child population from the Hispanic Health and Nutrition Examination Survey (HHANES). One hundred thirty three-to-sixteen-year-old children participated in the study. The children who were born in Mexico and those who spoke Spanish had seen the dentist less often and had a higher incidence of decayed teeth than those who were born in the US and than those who spoke English (p < 0.05). The children from low-income families had visited the dentist less frequently and did so at an older age than those from high income families (p < 0.05). When compared with HHANES, the children in this study visited the dentist at an older age, had been to the dentist less often, were less likely to have dental insurance, and had a higher incidence of dental caries than the children from HHANES (p > 0.05). This study demonstrated a general lack of dental health knowledge, a disproportionate prevalence of decayed teeth and unmet dental need in the Mexican-American migrant workers' children.
9586472	In this study, patient opinion on oral rehabilitation by means of Brnemark implants was investigated. All patients were referred to a periodontal clinic for implant installation and treated by one and the same operator. Prosthetic restorations were performed by dentists, who had no previous experience with prostheses on implants, but had completed a postgraduate training course. Patient opinion was obtained through questionnaires, pertaining to satisfaction and oral function. A comparison was made between pre-implant situation, short-term (< 4 months) and long-term functioning (3 years) with the implant-restorative rehabilitation. In total, 61 patients participated in the study; 23 received a full lower arch bridge and 18 a full upper arch bridge, while 20 patients got partial bridges. Of 298 installed implants, 7 failed at abutment connection (2.3%) and 1 during the 3-year follow-up interval (0.3%). The study results indicated that a great majority of patients were very satisfied with the treatment. Comfort with eating, aesthetics, phonetics and overall satisfaction improved significantly and nearly all patients said that they would undergo the treatment again or recommend it to others. Patients experienced their implants as "natural" teeth. The conclusion is that rehabilitation ad modum Brnemark, even in the hands of non-specialized dentists, can be of high quality, improving oral function and satisfying the needs and demands of patients.
8942125	To examine the prevalence of depressive symptoms and its relationship with quality-of-life domains in home-care cancer patients at an advanced stage of illness, 86 patients were given psychological tests for depression (Hospital Anxiety Depression Scale) (HAD) and quality of life (EORTC-QLQ-C30) 1 week after admission to the home-care program. Using a proper cut-off score on the HAD-Depression subscale, depressive symptoms were reported by 45% of the patients. The quality of life of depressed patients was more affected than non-depressed patients in the social, emotional, cognitive, and physical domains. Significant correlations were found between depression scores and impairment in most quality-of-life areas. These findings support the importance of depression and quality-of-life evaluation in patients with advanced cancer who are followed in a home-care setting. This evaluation is needed to provide patients, their families, and caregivers with appropriate psychosocial interventions.
11219561	These findings highlight the importance of relationship quality in determining patients' loyalty to a physician's practice. They suggest that in the race to the bottom line medical practices and health plans cannot afford to ignore that the essence of medical care involves the interaction of one human being with another.
10461579	Benchmarking is generally considered to be an important tool for quality improvement. Traditional approaches to benchmarking have relied on subjective identification of 'leaders in the field'. We derive an objective, reproducible and attainable Achievable Benchmark of Care (ABC) by measuring and analysing performance on process-of-care indicators. Three characteristics of the ABC that we deem essential are: (1) benchmarks represent a measurable level of excellence; (2) benchmarks are demonstrably attainable; (3) benchmarks are derived from data in an objective, reproducible and predetermined fashion. From these characteristics it follows that (4) providers with high performance are selected to define a level of excellence in a predetermined fashion, but (5) providers with high performance on small numbers of cases do not influence unduly benchmark levels. We use the 'pared mean' to operationalize the ABC. Roughly, the pared mean summarizes the performance of top-ranked providers whereby at least 10% of the patient pool across all providers is included. Bayesian estimators for adjustment of performance of providers with small sample sizes are used to rank providers. Randomized controlled trials to assess the independent effect of the ABC in quality improvement projects are under way. We have developed a methodology objectively and reproducibly to derive a level of excellent, attainable performance, based on measured performance by a group of providers. The ABC can be applied to groups of providers in communities, to institutions and departments within them, or to individual practitioners.
18370895	The FATE survey offers an important source of quality data that can be used to improve the end-of-life care of all veterans, regardless of the type of care they receive or their site of death.
17680901	This study reveals that patient race is associated with the quality of patient-physician communication to a greater extent than BP control. Interventions that improve patient-physician communication should be tested as a strategy to reduce racial disparities in hypertension care and outcomes.
17606959	Incapacitated patients without surrogates accounted for approximately 1 in 20 deaths in intensive care units. Most life-support decisions were made by physicians without institutional or judicial review.
10815125	The observed racial/ethnic differences in CAHPS ratings and reports of care are more a result of different experiences with care for people enrolled in the same plans than a result of racial/ethnic minorities being enrolled in plans with worse experiences. Health care organizations should engage in quality improvement activities to address the observed racial/ethnic disparities in assessments of care.
10069149	Considerable research has addressed quality of life and quality of care; however, it has not addressed adequately the experiences of patients and their families at the end of life. Health care may have a greater effect on quality of life during the dying process than it normally does. Building on research and expert review, a conceptual framework is presented that specifies and integrates quality of life and quality of health care indicators. Five main concepts include patient/family context, structure of care, process of care, satisfaction with care, and quality and length of life. Patient and family perspectives are considered. The framework emphasizes quality of life, thus detailed definitions of each quality of life domain are provided. The goal is to facilitate development of a comprehensive set of measures to describe the quality of life of dying persons and evaluate the care they receive, to be used to improve end-of-life care.
15880974	This study evaluates the feasibility, reliability, and validity of the Parent's Perceptions of Primary Care measure (P3C) in an underserved population: children of Latino farm workers. Bilingual research assistants verbally administered the P3C, as well as a measure of child health-related quality of life (HRQL: the PedsQL 4.0) and demographic questions to 297 Latino farm worker parents of young children, in San Diego and Imperial Counties. The P3C was found to be feasible, as measured by a very low percent of missing/do not know values. Internal consistency reliability for the Total Scale and most subscales was strong. The P3C's validity was demonstrated through factor analysis of the subscales, by showing that scores were lower for children without a regular physician and for children experiencing foregone health care, and by demonstrating that P3C scores were related to HRQL. The P3C can be useful to various stakeholders in measuring primary care for vulnerable populations.
15746592	NHQR and NHDR provide essential information on children's health care quality. Future reports can be improved by including child-relevant perspectives in priority-setting and data-gathering efforts.
12540939	Initial experience with this novel system has confirmed safety, patient satisfaction and surgeon satisfaction.
11433796	Hispanics in Medicare managed care face barriers to care; however, their experiences with care vary by language and region. Spanish speakers (except FL) have less favorable experiences with provider communication and office staff helpfulness than their English-speaking counterparts, suggesting language barriers in the clinical encounter. On the other hand, Spanish speakers reported more favorable experiences than their English-speaking counterparts with the managed care aspects of their care (getting needed care and plan customer service). Medicare managed care plans need to address the observed disparities in patient experiences among Hispanics as part of their quality improvement efforts. Plans can work with their network providers to address issues related to timeliness of care and office staff helpfulness. In addition, plans can provide incentives for language services, which have the potential to improve communication with providers and staff among Spanish speakers. Finally, health plans can reduce the access barriers faced by Hispanics, especially among English speakers.
11083669	Differences were evident in technologic and pharmacologic support and in physician prescribing habits in patients for whom life support was or was not withheld or withdrawn. Substantial variability was noted in physician documentation of physician-family interactions surrounding the withdrawal of life support.
7807659	Research on quality of care for children has lagged behind its counterpart for adults. Defining key issues and questions in seven topic areas-the health of children; the efficacy and effectiveness of health services for children; assessing quality of care; improving quality of care within health services delivery systems; assessing and improving quality at the community level; getting financial incentives right; and disseminating information about the results of research investigations-will facilitate the development of an effective research strategy. Ultimately, enhanced information in these areas will lead to improvements in the processes and outcomes of care for children.
12846852	Changes have been moderate in the perceived oral health in this cohort, despite the rather drastic changes in the remuneration of dental care during this study time. On the other hand, this also means that the social differences remain, despite the official goals of increased equity.
8840076	Utilization of various types of services for children's mental health problems was examined among 112 agricultural farm worker families. Pairs of mothers and children (aged 8 to 11) were interviewed using the Diagnostic Interview Schedule for Children and the Child and Adolescent Services Assessment. Sixty-four percent of the children met criterion for one or more psychiatric diagnoses. Children with a psychiatric diagnosis were five times more likely to see a health professional for a mental health problem compared to children without a psychiatric diagnosis However, less than half of the children with a psychiatric diagnosis saw a health professional for their mental health problems. Families also consulted with school professionals, religious leaders, and non-professionals (such as friends) concerning their children's mental health, but families of children who had a psychiatric diagnosis were not significantly more likely to report these types of consultations than were families of children who did not have a psychiatric diagnosis. These findings are discussed in terms of recommendations for improving the mental health service delivery system for rural children.
17197788	The shortened FS-ICU measures two main conceptual domains-satisfaction with care and satisfaction with decision making. Scores on the FS-ICU show good validity against other indicators of ICU quality. The instrument holds promise as a useful outcome measure in studies that attempt to improve this component of ICU care.
7790978	Both physician and patient preferences for CPR influence total hospital resource consumption. Physician misunderstanding of patient preferences to forego CPR was associated with increased use of hospital resources, and could have led to a course of care at odds with patients' expressed preferences in the event of cardiac arrest. Increasing physicians' knowledge of patient preferences, and increasing communication to help patients understand that options for medical care that include foregoing resuscitation efforts, might reduce hospital expenditures for the seriously ill.
11075528	Although preliminary evidence shows that people generally prefer to die at home, very little is known about where Canadians die. Understanding the epidemiology of dying in Canada may illuminate opportunities to improve quality of end-of-life care and related health policy. We conducted a cross-sectional analysis of death records in Canada to determine the proportions of deaths occurring in hospitals and special care units. Our analysis found that deaths in Canada occur in hospitals with provincial and territorial proportions ranging from 87% in Quebec to 52% in the Northwest Territories. In hospitals recording deaths in special care units, 18.64% of all deaths occurred in special care units. The proportion of deaths in special care units ranged from 25% in Manitoba to 7% in the Northwest Territories. The proportion of deaths in special care units varied by size and nature (teaching vs. non-teaching) of hospitals. It increased with the size of the hospital from 8% in hospitals with 1-49 beds, to 23% for hospitals with 400 or more beds. In teaching hospitals, 27% of deaths occurred in special care units, and in non-teaching hospitals the proportion was 15%. In conclusion, the majority of deaths in Canada occur in hospitals and a substantial proportion occur in special care units, raising questions about the appropriateness and quality of current end-of-life care practices in Canada.
12387641	Latinos recently became the largest racial/ethnic minority group of US children. The Latino Consortium of the American Academy of Pediatrics Center for Child Health Research, consisting of 13 expert panelists, identified the most important urgent priorities and unanswered questions in Latino child health. Conclusions were drawn when consensus was reached among members, with refinement through multiple iterations. A consensus statement with supporting references was drafted and revised. This article summarizes the key issues, including lack of validated research instruments, frequent unjustified exclusion from studies, and failure to analyze data by pertinent subgroups. Latino children are at high risk for behavioral and developmental disorders, and there are many unanswered questions about their mental health needs and use of services. The prevalence of dental caries is disproportionately higher for Latino children, but the reasons for this disparity are unclear. Culture and language can profoundly affect Latino children's health, but not enough cultural competency training of health care professionals and provision of linguistically appropriate care occur. Latinos are underrepresented at every level of the health care professions. Latino children are at high risk for school dropout, environmental hazards, obesity, diabetes mellitus, asthma, lack of health insurance, nonfinancial barriers to health care access, and impaired quality of care, but many key questions in these areas remain unanswered. This article suggests areas in which more research is needed and ways to improve research and care of Latino children.
14976909	Although customer loyalty is frequently cited as a benefit of patient satisfaction, an empirical link between the two has not, to our knowledge, ever been statistically established in a hospital setting. The goal of the present study was to evaluate the relationship between self-reported patient satisfaction measures and subsequent return to the provider for care at a large academic medical center. Data from all adult medical patients responding to a patient satisfaction survey distributed by a large midwestern academic medical center during fiscal year 1997 (n = 1485) were analyzed. Response patterns were examined as they related to whether patients returned to the provider during the subsequent 2-year period. Analyses suggested that return-to-provider was associated with only a minority of the satisfaction items (approx. 11%). All items showing a significant relationship measured perceptions of how well physicians and nurses attended to, and provided information to, patients and their families. Although the size of these relationships was generally small, the estimated financial implications are substantial. Other implications of these findings for planning effective service improvement initiatives as well as improving patient survey design are discussed.
18977978	For vulnerable children with asthma, barriers to care explain variance in primary care characteristics beyond that explained by access, demographic factors, and disease severity.
9714637	A substantial minority of US children were identified as having an existing special health care need using national survey data. Children with existing special health care needs are disproportionately poor and socially disadvantaged. Moreover, many of these children face significant barriers to health care.
16169788	Children with Medicaid insurance are less likely to attend scheduled visits for subspecialty asthma care, controlling for seasonal variation. Programs designed to address disparities in pediatric asthma outcomes regarding subspecialist care may improve their effectiveness by addressing barriers to attendance and anticipating poor attendance in the fall season.
10450723	African Americans and Latinos use services that require a doctor's order at lower rates than do whites. Racial bias and patient preferences contribute to disparities, but their effects appear small. Communication during the medical interaction plays a central role in decision making about subsequent interventions and health behaviors. Research has shown that doctors have poorer communication with minority patients than with others, but problems in doctor-patient communication have received little attention as a potential cause, a remediable one, of health disparities. We evaluate the evidence that poor communication is a cause of disparities and propose some remedies drawn from the communication sciences.
8215753	Residents and nurses caring for patients newly admitted to the ICU agree in their assessment of cognition, judgment, and capacity to participate in medical decision making, and are not unduly influenced by ventilator status. Their assessments correlate highly with abbreviated formal mental status testing.
20605850	The purpose of this study was to further validate a novel instrument to measure satisfaction with end-of-life care, called the Canadian Health Care Evaluation Project (CANHELP) questionnaire. Data were collected by a cross-sectional survey of patients who had advanced, life-limiting illnesses and their family caregivers, and who completed CANHELP, a global rating of satisfaction, and a quality of life questionnaire. We conducted factor analysis, assessed internal consistency using Cronbach's alpha, and evaluated construct validity by describing the correlation amongst CANHELP, global rating of satisfaction and the quality of life questionnaire scores. There were 361 patient and 193 family questionnaires available for analysis. In the factor analysis, we identified six easily interpretable factors which explained 55.4% and 60.2% of the variance for the patient and caregiver questionnaire, respectively. For the patient version, the subscales derived from these factors were Relationship with Doctors, Illness Management, Communication, Decision-Making, Role of the Family, and Your Well-being. For the family questionnaire, the factors were Relationship with Doctors, Characteristics of Doctors and Nurses, Illness Management, Communication and Decision-Making, Your Involvement, and Your Well-being. Each subscale for each questionnaire had acceptable to excellent internal consistency (Cronbach's alpha ranged from 0.69-0.94). We observed good correlations between the CANHELP overall satisfaction score and global rating of satisfaction (correlation coefficient 0.49 and 0.63 for patient and family, respectively) which was greater than the correlations between CANHELP and the quality of life instruments. We conclude that the CANHELP Questionnaire is a valid and internally consistent instrument to measure satisfaction with end-of-life care.
20179265	Higher patient satisfaction is associated with improved guideline adherence and lower inpatient mortality rates, suggesting that patients are good discriminators of the type of care they receive. Thus, patients' satisfaction with their care provides important incremental information on the quality of acute myocardial infarction care.
16956704	The paper reviews the existing research related to asthma disparities and frames the results of this research within a conceptual model modified from the Institute of Medicine model in order to explain asthma health disparities in Latino children in the USA. The model of pediatric asthma disparity presented is based on the conceptualization of health disparities as the result of a complex interaction of factors related to four main domains: the individual and family, the environment or context in which the child lives, the health-care system, and provider characteristics. Asthma disparities are discussed as they are reflected in the process of care (access and quality of treatment) and outcome (prevalence, morbidity, severity) experienced by Latino children. The potential mechanisms that may account for the asthma disparities documented as reflected by the conceptual model proposed are discussed. Finally, several suggestions for future research examining determinants that account for asthma disparities are examined.
6592350	A considerable number of Hispanic agricultural workers come to Northwest Michigan during the summer every year to harvest fruit and vegetable crops. The Department of Community Dentistry of The University of Michigan School of Dentistry helps provide dental services for these migrant workers and their families. Some 203 five-to-14-year-old children of migrant farm workers were examined for caries and periodontal condition and the results compared with recent national surveys. Traditional indicators of dental caries experience (DMFT/dft and DMFS/dfs indices), periodontal disease (PI), and oral cleanliness (OHI-S) were used by one examiner. These migrant children presented higher numbers of decayed teeth and lower numbers of restored teeth than United States schoolchildren generally. Migrant children also presented less caries-free teeth and higher PI and OHI-S scores than United States children generally.
19535929	Opinions of relatives should be taken into account when designing ICU information booklets. Relatives want more information than that anticipated by physicians or suggested in guidelines, but the youngest or the less-educated ones may respond less favorably to written information.
11468499	Financial, potential, and realized access to care are associated prospectively with the full range of primary care experiences--comprehensiveness, communication, coordination, and contextual knowledge--beyond continuity and accessibility. Access to a regular source of care and to needed care are each associated with larger effects on primary care experiences than is the presence of health insurance. Gaining insurance or a regular source of care results in primary care experiences similar to always having had these, while losing a regular source of care has a more immediate effect than losing insurance on primary care experiences.
