10869876	Dyspnea is a devastating symptom in patients with advanced cancer. Unfortunately, very limited research has been done on the frequency and correlates of dyspnea in this particular patient population. The purpose of this prospective study was to assess the frequency of moderate to severe dyspnea and the correlates of dyspnea in a population of ambulatory terminally ill cancer patients. One hundred thirty-five consecutive patients attending a multidisciplinary pain clinic were tested for respiratory function (vital capacity, peak flow, maximal inspiratory pressure, and oxygen saturation). All patients gave their rating of dyspnea, anxiety, and fatigue/tiredness using visual analogue scales (VAS). Lung involvement by the tumor (primary or metastatic) was determined from the patient's chart. Moderate dyspnea occurred in 74/135 (55%) patients with terminal cancer. Lung involvement (r = 0.285, P = 0. 0009), anxiety (r = 0.306, P = 0.0003), fatigue/tiredness (r = 0.211, P = 0.0146), and vital capacity (r = -0.189, P = 0.0444) were significantly correlated with the intensity of dyspnea. Multivariate analysis demonstrated that lung involvement (P = 0.0016) and anxiety (P = 0.0027) were independently correlated with the intensity of dyspnea. In the subgroup of patients with moderate to severe dyspnea, multivariate analysis found anxiety (P = 0.0318) and maximal inspiratory pressure (P = 0.0187) to be independent correlates of the intensity of dyspnea. Dyspnea is a frequent symptom in patients with advanced cancer. The presence of cancer in the lungs, anxiety, and maximal inspiratory pressure are correlates of the intensity of dyspnea in this patient population. Possible treatments addressing low maximal inspiratory pressure and anxiety are needed, as well as further research in finding new correlates of dyspnea in advanced cancer patients.
12727039	The objectives of this study were twofold: (1) to explore and compare the symptom experience of seriously ill hospitalized cancer and noncancer patients near the end of life using the Memorial Symptom Assessment Scale (MSAS) and (2) to determine if the MSAS is a valid and useful measure of symptom distress for patients with noncancer conditions. This was a prospective cohort study of hospitalized patients with end-stage congestive heart disease, chronic pulmonary disease, cirrhosis, or metastatic cancer. Eligible patients were interviewed to ascertain symptom prevalence, severity and distress using the MSAS and levels of fatigue using the Piper Fatigue Scale (PFS). Sixty-six patients with metastatic cancer and 69 patients with end-stage disease were enrolled in the study. There was a significant difference in the prevalence of selected physical symptoms, but not psychological symptoms, between cancer and noncancer patients. There were no significant differences in symptom distress scores, a computed score of frequency, severity and distress, if the symptom was present. In both groups the principal components factor analysis with varimax rotation yielded one factor comprising psychological symptoms and a second factor comprising three subgroups of physical symptoms. Internal consistency was high for the psychological subscale (Cronbach alpha coefficients of 0.85 for the cancer group and 0.77 for the noncancer group) and for the physical subscale groupings, with coefficients ranging between 0.78 to 0.87. The symptom scores were significantly correlated with perceptions of fatigue. These findings show that both seriously ill cancer and noncancer patients experience symptom distress, and that the MSAS seems to be a reliable measure of symptom distress in noncancer patients, as well as with cancer patients.
8008037	Despite published guidelines for pain management, many patients with cancer have considerable pain and receive inadequate analgesia.
9477029	In a clinical follow-up study 42 patients were selected from an original sample of 335 individuals who had undergone extensive prosthetic treatment. The selection was done in accordance with a treatment satisfaction measure. The selected patients' appliances were classified in accordance with the California Dental Association (CDA) quality assessment system. Altogether, most of the new reconstructions were rated as satisfactory. The removable partial dentures had a somewhat higher share of non-acceptable appliances according to the CDA criteria. There was an association between the CDA categories and patient satisfaction. Using logistic regression analysis and knowing the CDA rating, we could correctly classify 67% of the patients with regard to the satisfaction measure. The satisfaction measure was modified on the basis of an interview, improving the model to 83% correctly classified. It was concluded that the technical quality of the prosthodontic treatment was associated with patient satisfaction.
7639882	Public health and medical care interventions have produced dramatic changes in the health of children in the United States. Emerging new morbidities such as behavioral and learning disorders, and child abuse and neglect, highlight the lack of an integrated system of health. Children's developmental vulnerability, dependency, and unique morbidities have been underemphasized in the organization and delivery of health care. The Andersen and Aday model of health care utilization is used to describe financial and nonfinancial barriers to care for children that include family characteristics and organizational characteristics of the health system. Case studies of immunization delivery, children with chronic illness, and mobile populations of children reveal the mismatch between the health care system and children's basic health needs. Integrated service models for high-risk populations of children represent an essential mechanism for coordinating the delivery of medical, developmental, educational, and social services needed by children and families. Universal, coordinated public health and medical services of adequate scope and quality should be assured for children through market and health system reform.
9592438	Migrant farmworkers are one of the most health care-impoverished populations in the United States. Mobility, hazardous occupations, cultural diversity, and low socioeconomic status place migrants, and particularly migrant children, at high risk for inadequate health care and preventable health problems. This article presents a synthesis of the existing research on migrant demographics, major health risks, and geographic, financial, and cultural barriers to health care access. Innovative nursing strategies to enhance access and improve the health of migrant children are explored. These include the use of lay community outreach workers, the creation of alternative health care delivery models, and the development of information tracking systems.
9361659	Bereaved family members are generally satisfied with life-sustaining treatment decisions. Their primary concerns are failures in communication and pain control. Discussions that focus on specific treatment decisions may not satisfy the real needs of dying patients and their families.
3352333	Although the quantity and, in many cases, the quality of research on the practitioner-patient interaction has improved over the last 10-15 years, many related topics remain largely unexplored. The relationship of the similarity of practitioner and patient preferences to treatment adherence has not been carefully investigated, either in a medical or dental setting. This paper presents a study of patient and practitioner preferences for a dental appointment, and assesses the impact of their similarity on patient satisfaction with the appointment and adherence to the recommended treatment regimen. Results indicate that the similarity of patient and dental student preferences for an appointment is a very significant predictor of patient satisfaction with the appointment, reported improvement in oral hygiene behavior, and actual improvement in objective dental health. Patient satisfaction was, in turn, an independent predictor of reported behavior change and objective improvement in dental health. Similarity of patient and practitioner preferences for appointments should be studied more carefully in future doctor- and dentist-patient interaction research, as it is a critical variable for understanding how the interaction experience is translated into patient behavior.
9854692	Priority health-risk behaviors, which contribute to the leading causes of mortality and morbidity among youth and adults, often are established during youth, extend into adulthood, and are interrelated. The Youth Risk Behavior Surveillance System (YRBSS) monitors six categories of priority health-risk behaviors among youth and young adults--behaviors that contribute to unintentional and intentional injuries; tobacco use; alcohol and other drug use; sexual behaviors that contribute to unintended pregnancy and sexually transmitted diseases (STDs) (including human immunodeficiency virus [HIV] infection); unhealthy dietary behaviors; and physical inactivity. The YRBSS includes a national school-based survey conducted by the Centers for Disease Control and Prevention as well as state, territorial, and local school-based surveys conducted by education and health agencies. This report summarizes results from the national survey, 33 state surveys, 3 territorial surveys, and 17 local surveys conducted among high school students from February through May 1997. In the United States, 73% of all deaths among youth and young adults 10-24 years of age result from only four causes: motor vehicle crashes, other unintentional injuries, homicide, and suicide. Results from the national 1997 YRBSS demonstrate that many high school students engage in behaviors that increase their likelihood of death from these four causes--19.3% had rarely or never worn a seat belt; during the 30 days preceding the survey, 36.6% had ridden with a driver who had been drinking alcohol; 18.3% had carried a weapon during the 30 days preceding the survey; 50.8% had drunk alcohol during the 30 days preceding the survey; 26.2% had used marijuana during the 30 days preceding the survey; and 7.7% had attempted suicide during the 12 months preceding the survey. Substantial morbidity among school-age youth, young adults, and their children also result from unintended pregnancies and STDs, including HIV infection. YRBSS results indicate that in 1997, 48.4% of high school students had ever had sexual intercourse; 43.2% of sexually active students had not used a condom at last sexual intercourse; and 2.1% had ever injected an illegal drug. Of all deaths and substantial morbidity among adults greater than or equal to 25 years of age, 67% result from two causes--cardiovascular disease and cancer. Most of the risk behaviors associated with these causes of death are initiated during adolescence. In 1997, 36.4% of high school students had smoked cigarettes during the 30 days preceding the survey; 70.7% had not eaten five or more servings of fruits and vegetables during the day preceding the survey; and 72.6% had not attended physical education class daily. These YRBSS data are already being used by health and education officials to improve national, state, and local policies and programs to reduce risks associated with the leading causes of morbidity and mortality. YRBSS data also are being used to measure progress toward achieving 21 national health objectives and one of the eight National Education Goals.
16466343	The objective of this study was to determine the association between continuity of care and emergency room visits/hospital care for patients with asthma. A population-based study was conducted using administrative healthcare datasets obtained from Alberta Health and Wellness, Alberta, Canada. The 4-year study period extended from April 1, 1996 to March 31, 2000, and took place at the Palliser Health Region in Alberta, Canada, which has a population of 88,000 people. A population-based sample of 2774 patients, diagnosed with asthma between ages 5 and 45 with two or more office visits for asthma and who lived in the Palliser Health Region for 2 consecutive years during the study period, was studied. The main outcome measure was the association of continuity of care with hospitalizations and emergency room visits for patients with asthma. Continuity of care was the proportion of total physician visits made to the most frequently visited physician. High continuity of care was associated with a decreased risk of an emergency visit (OR = 0.24: 95% CI 0.19-0.29), number of emergency visits (RR = 0.37; 95% CI 0.32-0.42), decreased risk of number of hospitalizations (RR = 0.69; 95% CI 0.54-0.89), and total days in hospital (average difference = 0.77; 95% CI 0.63-0.95), but not with ever hospitalized. High continuity of care was associated with a 60%-75% reduction in emergency room visits and an approximate 25% reduction in number of hospitalizations in patients with asthma. Interventions to improve continuity of care could have the potential to improve care and reduce cost.
16651291	Black children are more likely to have asthma and to experience ED visits for asthma, compared with otherwise comparable white children, and these racial disparities cannot be explained by differences in measurable child or family characteristics. These results suggest that racial disparities in asthma continue to pose risks for black children, and they point to the need for additional research into potential explanations and remedies.
12350182	Unsolicited patient complaints captured and recorded by a medical group are positively associated with physicians' risk management experiences.
15173469	National results using 4 complementary composite quality measures confirm the need for improving the quality of preventive and developmental services for young children in the United States. The 4 measures identify areas of care and subgroups of children for whom improvements in quality are most needed. The measures provide a parsimonious yet comprehensive assessment across distinct health supervision topics and 4 essential aspects of preventive and developmental services. Until valid measures of outcomes of preventive and developmental services are identified or 1 single process of care measure is shown to be highly predictive of these outcomes, assessing multiple aspects of recommended care will be necessary to assess performance of health care providers or systems of care.
3749965	This research examines preventive medical care, morbidity and mortality among children of migrant agricultural workers using a representative sample of migrant families in Wisconsin. Our findings support the view that this group is at substantially greater risk of health problems and early mortality than the general population. Fewer than half of migrant children under age 16 received the recommended annual physical checkup. Only one-third of migrant children under age 16 had received an annual dental checkup compared to 50% of children in the total population. A rough comparison between levels of chronic health conditions for migrant children and those reported for children in a national survey suggest that the incidence of chronic conditions is several times greater among migrant children. Childhood mortality appears to be 1.6 times higher than in the U.S. population. In analyzing variation in preventive care for migrant children, younger children are more likely to receive checkups, while older children are more likely to receive immunizations. In interpreting this finding, we suggest distinguishing between two types of preventive care: one under the direct control of the family, and the other controlled by the schools. Since immunizations are given to migrant children in schools, the older or school-age children are more likely to be immunized. In assessing reports of chronic conditions, we noted that mothers who spoke English were more likely to report that a child had a chronic condition. One possible interpretation is that women who do not speak English may not label various childhood conditions as chronic illnesses. Since a large proportion of women spoke only Spanish, the chronic conditions may be substantially under-reported among migrant children. The analysis of childhood mortality shows the level of mortality to be proportionally lower among women who spoke English, and higher among those who gave birth to a low birth weight child. But surprisingly, the most important characteristic related to loss of children was whether or not a mother smoked. Using smoking as one example of high risk behavior, we suggest that future studies should give closer attention to the impact of parental risk-taking behaviors on childhood morbidity and mortality experiences.
15039410	Many people dying in institutions have unmet needs for symptom amelioration, physician communication, emotional support, and being treated with respect. Family members of decedents who received care at home with hospice services were more likely to report a favorable dying experience.
10705703	To reduce racial/ethnic disparities in primary care, attention should be paid both to policies aimed at improving potential access and to providing linguistically appropriate services.
17277013	Language barriers appear to increase the risks to patient safety. It is important for patients with language barriers to have ready access to competent language services. Providers need to collect reliable language data at the patient point of entry and document the language services provided during the patient-provider encounter.
11324211	Patients with reconstruction of craniofacial or intraoral defects experience a profound impact on their quality of life (QOL). This impact on QOL is influenced by the patients' medical conditions and the treatment interventions. Instruments to measure general QOL have been available for many years. A major criticism of QOL instruments is that too often the questions are not specific to the particular problems of a disease or condition. A search of the literature regarding QOL measurement for patients with maxillofacial implant-supported prostheses produced a short list of instruments, none of which were sufficiently developed or suited to the patients involved in reconstructive treatment. This study was designed to develop pretreatment and posttreatment questionnaires for measuring QOL for patients with reconstruction of a craniofacial defect and patients with reconstruction of loss of specific intraoral structures utilizing an implant-supported prosthesis (e.g., severe resorption of the maxilla or mandible or both). The goal was to develop brief, targeted instruments for this specific patient population. The produced instruments were sensitive and easy to administer and score, and no disruption of clinical care occurred with the administration of the questionnaires. The instruments were used with equal success both in face-to-face interviews and via mail.
6824257	The quality of physician-patient communication affects important health care outcomes. Managed care presents a number of challenges to physician-patient communication, including shorter visits, decreased continuity, and lower levels of trust. Good communication skills can help physicians create and maintain healthy relationships with patients in the face of these challenges. We describe 5 communication dilemmas that are common in managed care and review possible solutions suggested by recent literature on physician-patient communication. We also describe ways that managed care plans can promote more effective communication between physicians and patients.
15249562	Delirium was an independent predictor of higher 6-month mortality and longer hospital stay even after adjusting for relevant covariates including coma, sedatives, and analgesics in patients receiving mechanical ventilation.
9475476	Health plans need to pay increased attention to racial/ethnic differences in assessments of care. This study's finding that language barriers are largely responsible for racial/ethnic disparities in care suggests that linguistically appropriate health care services are needed to address these gaps.
9413309	Improvements in quality of care for Asians/Pacific Islanders are needed. Comparisons of care in racially and ethnically diverse populations based on global ratings of care should be interpreted cautiously.
12165584	Recent data suggest that the burden from childhood asthma may have recently plateaued after several years of increasing, although additional years of data collection are necessary to confirm a change in trend. Racial and ethnic disparities remain large for asthma health care utilization and mortality.
11483786	The P3C is a practical, reliable, and valid measure of parents' reports of pediatric primary care quality. This brief measure could be used alone, or in conjunction with other measures, to enhance outcomes and evaluate the impact of systems changes on the delivery of the main elements of primary care.
12620760	Loss of dignity is closely associated with certain types of distress often seen among the terminally ill. Preservation of dignity should be an overall aim of treatment and care in patients who are nearing death.
20736823	Assessing and analyzing family satisfaction in the ICU ultimately will support healthcare professionals in their continuing effort to improve care of critically ill patients and their families.
20445131	Effective communication is critical to providing quality health care and can be affected by a number of modifiable organizational factors. The authors performed a prospective multisite validation study of an organizational communication climate assessment tool in 13 geographically and ethnically diverse health care organizations. Communication climate was measured across 9 discrete domains. Patient and staff surveys with matched items in each domain were developed using a national consensus process, which then underwent psychometric field testing and assessment of domain coherence. The authors found meaningful within-site and between-site performance score variability in all domains. In multivariable models, most communication domains were significant predictors of patient-reported quality of care and trust. The authors conclude that these assessment tools provide a valid empirical assessment of organizational communication climate in 9 domains. Assessment results may be useful to track organizational performance, to benchmark, and to inform tailored quality improvement interventions.
17664258	Parents of patients at resident continuity sites rated residents as providers of high-quality care to a socioeconomically disadvantaged population as compared with a previously published community sample. Efforts to improve resident continuity and identification may help improve care delivered in resident practices.
11230593	Lower continuity of primary care is associated with higher risk of ED utilization and hospitalization. Efforts to improve and maintain continuity may be warranted.
15849881	In general, most measures have not undergone rigorous development and testing. Measure development in end-of-life care should focus on areas with identified gaps, and testing should be done to facilitate comparability across the care settings, populations, and clinical conditions. Intervention research should use robust measures that adhere to these standards.
10439490	Improved communication between patients and providers, and continuity of care are associated with increased provision of preventive services, while other aspects of PCC are not strongly related to delivery of preventive services.
10121552	Migrant farmworkers lead a hard life filled with strenuous work, stress, and anxiety about employment; live under substandard conditions; and rarely get the health care they require. Preventive care is a luxury they cannot afford. Year-round nutritious meals are rarely possible, due to long working hours, traveling, and living in housing without adequate cooking and refrigeration facilities. Children may attend up to six or more schools during the course of a school year. Crowded housing conditions support the invasion of parasites, infectious diseases, and viral infections. Dermatological conditions from working around a wide variety of plants, dirt, and in the sun are frequent. Exposure to pesticides, herbicides, and other chemical additives creates the likelihood of acute reactions, such as headaches and rashes, and also puts workers at risk of developing chronic diseases as the level of exposure rises because of accumulation and mix of various chemicals. Yet, we know little about the health status of this population. We are unable to estimate crude death rates, age-specific death rates, or prevalence rates of most common causes of death, such as heart disease,cancer and stroke. There is no information about occupational accident rates, infectious disease rates, or even postneonatal mortality. We do know that when migrants go to a clinic, they are often likely to have the chronic conditions of hypertension or diabetes. They present symptoms of acute conditions such as dental problems, dermatitis, otitis media among children, and acute upper respiratory infections. Women frequently need obstetrical care, reflected (ABSTRACT TRUNCATED AT 250 WORDS)
