11293838	Surveys such as the CABHS can identify aspects of the plan and treatment that are improvement priorities. Use of these data is likely to extend beyond the behavioral health plan to consumers, purchasers, regulators, and policymakers, particularly because the National Committee for Quality Assurance is encouraging behavioral health plans to use a similar survey for accreditation purposes.
14653278	It has been suggested that patients should accept the use of the air abrasion technique over the conventional handpiece due to the reduced need for anesthesia. Technologies for both air abrasion and the conventional rotary handpiece have, in recent decades, seen major improvements, but there are no recent scientific publications that evaluate the patient's preference for these two technologies when performing a cavity preparation. This study determined the patient's preference for air abrasion or the rotary handpiece for removing occlusal fissure carious lesions in mandibular premolars. Ten healthy subjects 18 years of age or older were recruited from the General Dentistry Clinic of the University of Rochester Eastman Dental Center, with fissure caries at a DEJ depth of similar size (determined by radiographs and clinical examination) in any two mandibular premolars in opposite quadrants. Within each subject, the two methods of caries removal were randomly assigned. In one premolar, air abrasion was used for cavity preparation, and in the other premolar, a conventional rotary handpiece was used. At each visit prior to treatment, the patients were instructed to complete the Emotional Status (ES) questionnaire (SUNY University at Buffalo Craniofacial Pain Clinic) to assess differences in their emotional status between appointments. At each appointment, when the restorative treatment was completed, patients were instructed to rate their pain on the Visual Analogue Scale (VAS). A technique preference questionnaire was given after the second appointment. The subjects rated the perception of pain as significantly lower (p < 0.05) when using air abrasion (6.0 mm versus 29.6 mm). All of the patients preferred air abrasion over conventional rotary handpieces. None of the patients required anesthesia and there was no indication that the emotional status influenced the result. Air abrasion was the preferred method of cavity preparation when removing fissural caries in mandibular premolars and most subjects did not experience any pain when air abrasion was used.
14529039	This study examined the satisfaction of family members with the end-of-life care their loved ones received. Data were collected from 1,839 individuals receiving care from 17 different care agencies nationwide. Although family satisfaction with hospice care was generally quite high. situational factors played a role. The timing of the referral was critical, with families rating services lower almost across the board when the referral to hospice was deemed "too late." Additionally, families expressed greater satisfaction when the patient's care was overseen by the hospice director, rather than a personal physician. Each of these findings has important implications for physicians, patients, and families as they begin to plan for end-of-life care.
11532587	A fundamental barrier to improving the quality of medical care at the end of life is the lack of measurement tools. The Toolkit of Instruments to Measure End of Life Care (TIME) aims to fill that void by creating measurement tools that capture the patient and family perspective. To develop a conceptual model for a retrospective survey of bereaved family members that incorporates both professional and family perspectives on what constitutes good care at the end of life, a qualitative literature review of existing professional guidelines and six focus groups with bereaved family members from acute care hospitals (n = 2), nursing homes (n = 2), and hospice/VNA home health services (n = 2) was performed. The focus groups were held in Arizona, New York, and Massachusetts and included 42 bereaved family members/friends contacted 3-12 months from the time of patient's death. Domains of care that define quality end-of-life care were defined. Focus group participants defined high quality medical care as: 1) providing dying persons with desired physical comfort; 2) helping dying persons control decisions about medical care and daily routines; 3) relieving family members of the burden of being present at all times to advocate for their loved one; 4) educating family members so they felt confident to care for their loved ones at home; and 5) providing family members with emotional support both before and after the patient's death. The qualitative literature review yielded similar results, except that the professional guidelines did not mention the advocacy burden felt by families. These two sources provided the foundation for a conceptual model of patient-focused, family-centered medical care and a new tool for surveying bereaved family members. Views of bereaved family members' stories and professional guidelines help to identify key domains of quality of end-of-life care. A new survey instrument provides a way to incorporate the perspectives of bereaved family members in measuring the quality of end-of-life care.
3162273	Sixty-nine male patients participated in a self-evaluation survey measuring their satisfaction with maxillary and mandibular dentures. Patients generally had a high evaluation of their dentures, with the highest scores given to appearance. Age was not a significant predictor of denture success. Patients receiving their first dentures consistently had more difficulties in all categories of function, comfort, and appearance than patients with past experience with dentures.
11074777	Although pain and symptom management, communication with one's physician, preparation for death, and the opportunity to achieve a sense of completion are important to most, other factors important to quality at the end of life differ by role and by individual. Efforts to evaluate and improve patients' and families' experiences at the end of life must account for diverse perceptions of quality. JAMA. 2000;284:2476-2482.
17566011	Earlier discussions about treatment failure and end-of-life care, and the need for palliation, appear to be central to improving the quality of end-of-life care for patients dying on our medical teaching unit. Our results are consistent with other studies in this area.
20887572	Perceptions of past racism and classism in healthcare settings may negatively impact the affective tone of subsequent patient-provider communication.
12682650	This exploratory study's findings suggest that dental patients have distinct preferences in relation to treatment decision-making role and that these may not always be met during consultations with their dentist. The Control Preferences Scale appears to be appropriate for use in dental settings.
11118234	The rapid pace of change in the health care system presents tremendous challenges for clinicians and managers charged with the delivery of mental health and substance abuse services. Declining reimbursement, new incentive structures, and increasing competition are placing unprecedented pressure on providers to deliver care efficiently. Regulatory scrutiny, consumer dissatisfaction, and a growing awareness of gaps between actual and ideal practice have led to intensifying pressure to improve quality. Yet system change has also presented new opportunities for managing cost and quality of care. Consolidation of facilities and practices into integrated networks, developments in information systems technology, and the emergence of models to facilitate change have led to the rise of "quality management," a framework for assessing and improving clinical, operational, and financial performance within a health care organization. This article reviews some of the precipitating factors and theoretical structures underlying quality management and then, through a case study of one organization's experience, describes the implementation of a quality management program in a behavioral health care delivery system. The case study emphasizes how theoretical frameworks were operationalized and how organizational structure and process were shaped to address challenges well known in quality management, such as authority, accountability, and follow-through. A multiphase model of quality management program development is formulated and used to provide context for this program's development.
11409676	It was concluded that sensitivity to change of the OHIP was good. This property was not improved by using statement weights.
11219473	The TSQM is a psychometrically sound and valid measure of the major dimensions of patients' satisfaction with medication. Preliminary evidence suggests that the TSQM may also be a good predictor of patients' medication adherence across different types of medication and patient populations.
7537317	This study was designed to characterize unmet analgesic needs in a group of cancer patients. One hundred one inpatients were surveyed to document pain prevalence and intensity, satisfaction with pain control and factors associated with unmet analgesic needs during the week prior to admission. Forty-four percent had unmet analgesic needs, defined as pain of moderate or greater than moderate intensity. These patients had a significantly greater prevalence of bone and axillary node involvement, higher than pain intensity, and less satisfaction with pain control. Fifty-nine percent were satisfied with pain control. Dissatisfaction was associated with higher usual pain intensity, less satisfaction with physician information about pain etiology, less frequent attribution of pain to disease, sharp pain, constant and intermittent pain, patient perceptions of less physician concern about pain, patient and physician belief that the patient is receiving insufficient analgesic, and patient wanting more control over analgesic regimen. Patients may benefit from improved treatment of specific syndromes and by attention to communication.
4436074	Although the results demonstrate a need to adjust policies designed to improve utilization by accounting for particular problems faced by minority populations, they also demonstrate the primacy of addressing financial access.
12130994	Most family members were highly satisfied with the care provided to them and their critically ill relative in the intensive care unit. Efforts to improve the nature of interactions and communication with families are likely to lead to improvements in satisfaction.
12183092	End-of-life care in Canada may be improved for patients and their families by providing better psychological and spiritual support, better planning of care and enhanced relationships with physicians, especially in aspects related to communication and decision-making.
11092163	This article develops a conceptual model of cultural competency's potential to reduce racial and ethnic health disparities, using the cultural competency and disparities literature to lay the foundation for the model and inform assessments of its validity. The authors identify nine major cultural competency techniques: interpreter services, recruitment and retention policies, training, coordinating with traditional healers, use of community health workers, culturally competent health promotion, including family/community members, immersion into another culture, and administrative and organizational accommodations. The conceptual model shows how these techniques could theoretically improve the ability of health systems and their clinicians to deliver appropriate services to diverse populations, thereby improving outcomes and reducing disparities. The authors conclude that while there is substantial research evidence to suggest that cultural competency should in fact work, health systems have little evidence about which cultural competency techniques are effective and less evidence on when and how to implement them properly.
11889645	This study is one of the first to report that the use of certain cognitive coping strategies is associated with positive outcome for patients suffering from orofacial pain. These findings underscore the importance of individual differences on behavioral and psychosocial parameters in the prediction of patients' subjective evaluation of treatment outcome.
16192158	The relationship between limited health literacy and poor health may be due, in part, to poor communication quality within health care delivery organizations. We explored the relationship between health literacy status and receiving patient-centered communication in clinics and hospitals serving communication-vulnerable patient populations. Thirteen health care organizations nationwide distributed a survey to 5929 patients. All patients completed seven items assessing patient-centered communication. One third also completed three items assessing health literacy. The majority of patients had self-reported health literacy challenges, reporting problems learning about their medical condition because of difficulty understanding written information (53%), a lack of confidence in completing medical forms by themselves (61%), and needing someone to help them read hospital/clinic materials (57%). Logistic regression models showed that, after adjustment for patient demographic characteristics and health care organization type, patients with limited health literacy were 28% to 79% less likely than those with adequate health literacy to report their health care organization "always" provides patient-centered communication across seven communication items. Using a scaled composite of these items, limited health literacy remained associated with lower reported communication quality. These results suggest that improving communication quality in health care organizations might help to address the challenges facing patients with limited health literacy. They also highlight that efforts to address the needs of patients with limited health literacy should be sensitive to the range of communication challenges confronting these patients and their caregivers.
10183285	Health care report cards have been endorsed as a mechanism for efficiently comparing key quantifiable aspects of performance across a range of health systems or plans. There are challenges in determining what to measure; how to gather and analyze data; and how to report, interpret, and use findings. Mental health has received little attention, and a consumer perspective is typically not included. The proposed MHSIP mental health report card (MMHRC) addresses these concerns. General issues for report cards are discussed, and the MMHRC is described in terms of content, data sources and quality, and analysis and reporting.
8968258	Pain is common among severely ill hospitalized patients. The most important variables associated with pain and satisfaction with pain control were patient demographics and those variables that reflected the acute illness. Pain and satisfaction with pain control varied significantly among study sites, even after adjustment for many potential confounders. Better pain management strategies are needed for patients with the serious and common illnesses studied in SUPPORT.
12521327	The present study evaluates the performance of patient-centred outcome measures in the oral medicine setting in patients with oral lichen planus. The study included 48 patients with a histologically confirmed diagnosis of oral lichen planus who completed a questionnaire incorporating two patient-centred outcome measures: the 16-item UK Oral Health Related Quality Of Life Measure (OHQOL-UK) and 14-item Oral Health Impact Profile (OHIP-14). They subsequently underwent an oral examination and rated the pain they experienced on a visual analogue scale (VAS). The impact of oral health on their life quality was considerable with physical, social and psychological consequences. Both OHQOL-UK (P<0.01) and OHIP-14 scores (P<0.01) were associated with clinical findings; demonstrating criterion validity. Patient rating of pain experienced (on a VAS) correlated with OHQOL-UK scores (P<0.01) and OHIP-14 (P<0.01); demonstrating construct validity. The mean inter-item correlation for OHQOL-UK was 0.93 and was 0.90 for OHIP-14; demonstrating high internal consistency reliability. Our results suggest both OHQOL-UK and OHIP-14, patient-centred outcome measures perform well in patients with oral lichen planus, demonstrating validity and reliability. This implies patient-centred outcome measures may be utilized in both oral medicine and oral and maxillofacial surgery to assess patient needs and opinions.
15741710	Despite substantial asthma prevalence and morbidity, children from Spanish-speaking families are at high risk of inadequate maintenance therapy. The reasons for this remain unclear. The objective of this study was to compare patterns of asthma morbidity and access to care of children with asthma from Spanish-speaking and English-speaking families. Cross-sectional data from a nationally representative sample of children with asthma 2-17 years of age were analyzed from the 1999 National Health Interview Survey, conducted in both English and Spanish, with the preferred language identified at the time of the interview. Among the 1,228 children with asthma (physician-diagnosed asthma by parent report), 66 (3%) were from Spanish-speaking families and 1,162 (97%) were from English-speaking families. In a logistic regression model adjusting for gender, insurance, poverty (above or below the federal poverty level, based on reported family income and the U.S. Poverty Threshold produced annually by the Census Bureau), and race/ethnicity, children with asthma from Spanish-speaking families were one-third less likely to have a usual health care provider (odds ratio [OR] 0.31, 95% confidence interval [CI] 0.1-0.8) than children with asthma from English-speaking families. Latino ethnicity was not independently associated with diminished continuity of care. These data indicate that children with asthma from Spanish-speaking families are less likely to experience continuity of health care than their counterparts from English-speaking families. Differences in continuity of care may contribute to inadequate asthma maintenance therapy among these children.
6592306	In a cross-over study, intravenous diazepam was compared with rectal diazepam for sedation in outpatient oral surgery. Fifty-four operations were performed on 27 patients. Recovery from sedation, experience during the postoperative course, amnesia, estimation of the sedative effect, and patient preference of method of sedation were studied. The recovery times of the sedation methods did not differ. Sedative effects after the first operation were estimated as good by 87% of patients given intravenous sedation and by 75% of those given rectal sedation. However, there was a significant relationship between the subjective experience of stronger sedative effect and preference of sedation method that favored the intravenous technique. The degree of amnesia was significantly higher during intravenous sedation, but a high degree of amnesia was not related to patients' preference for a sedation method. Neither sedation method produced any local side effects.
19098110	Little is known about the lived health-care experiences of persons living with palliative stage Parkinson's disease and the family members who care for them. An exploratory phenomenological investigation was adopted to understand participant's lived health-care experiences and the needs flowing from them. Three family groupings participated in semi-structured in-depth interviews. Interpretative phenomenological analysis revealed three main themes: missing information, being on your own, wanting and not wanting to know. Findings support previous research that indicate palliative care needs are not being met in our current health-care model and that palliative care services should be multi-disciplinary team-based in order to provide comprehensive support to patients and families. Based on this current work, we are currently undertaking a comprehensive quantitative-based multi-disciplinary health-care service needs assessment of palliative stage PD patients with the goal to implement expanded services.
10697808	Alternative high schools serve approximately 280,000 students nationwide who are at high risk for failing or dropping out of regular high school or who have been expelled from regular high school because of illegal activity or behavioral problems. Such settings provide important opportunities for delivering health promotion education and services to these youth and young adults. However, before this survey, the prevalence of health-risk behaviors among students attending alternative high schools nationwide was unknown. The Youth Risk Behavior Surveillance System (YRBSS) monitors the following six categories of priority health-risk behaviors among youth and young adults: behaviors that contribute to unintentional and intentional injuries; tobacco use; alcohol and other drug use; sexual behaviors that contribute to unintended pregnancy and sexually transmitted diseases (STDs) (including human immunodeficiency virus [HIV] infection); unhealthy dietary behaviors; and physical inactivity. The national Alternative High School Youth Risk Behavior Survey (ALT-YRBS) is one component of the YRBSS; it was conducted in 1998 to measure priority health-risk behaviors among students at alternative high schools. The 1998 ALT-YRBS used a three-stage cluster sample design to produce a nationally representative sample of students in grades 9-12 in the United States who attend alternative high schools. The school response rate was 81.0%, and the student response rate was 81.9%, resulting in an overall response rate of 66.3%. This report summarizes results from the 1998 ALT-YRBS. The reporting period is February-May 1998. In the United States, 73.6% of all deaths among youth and young adults aged 10-24 years results from only four causes--motor vehicle crashes, other unintentional injuries, homicide, and suicide. Results from the 1998 ALT-YRBS demonstrate that many students at alternative high schools engage in behaviors that increase their likelihood of death from these four causes. During the 30 days preceding the survey, 51.9% had ridden with a driver who had been drinking alcohol, 25.1% had driven a vehicle after drinking alcohol, 32.9% had carried a weapon, 64.5% had drunk alcohol, and 53.0% had used marijuana. During the 12 months preceding the survey, 15.7% had attempted suicide, and 29.0% had rarely or never worn a seat belt. Substantial morbidity among school-aged youth and young adults also results from unintended pregnancies and STDs, including HIV infection. ALT-YRBS results indicate that in 1998, a total of 87.8% of students at alternative high schools had had sexual intercourse, 54.1% of sexually active students had not used a condom at last sexual intercourse, and 5.7% had ever injected an illegal drug. Among adults aged > or = 25 years, 66.5% of all deaths result from two causes--cardiovascular disease and cancer. Most risk behaviors associated with these causes of death are initiated during adolescence. In 1998, a total of 64.1% of students at alternative high schools had smoked cigarettes during the 30 days preceding the survey, 38.3% had smoked a cigar during the 30 days preceding the survey, 71.2% had not eaten > or = 5 servings of fruits and vegetables during the day preceding the survey, and 81.0% had not attended physical education (PE) class daily. Comparing ALT-YRBS results with 1997 national YRBS results demonstrates that the prevalence of most risk behaviors is higher among students attending alternative high schools compared with students at regular high schools. Some risk behaviors are more common among certain sex and racial/ethnic subgroups of students. ALT-YRBS data can be used nationwide by health and education officials to improve policies and programs designed to reduce risk behaviors associated with the leading causes of morbidity and mortality among students attending alternative high schools.
