10183283	This article discusses the concepts and approaches underlying managed behavioral health care and the need to assess quality of care. The author describes the Performance Measures for Managed Behavioral Healthcare Programs (PERMS) developed by the American Managed Behavioral Healthcare Association (AMBHA), which is offered as a first step toward enhanced quality of care assessment in managed behavioral health care.
10183287	This article reports on the National Alliance for the Mentally Ill (NAMI) national report card to examine quality of care under managed care. The national report card will provide a summary of state policies underpinning the move of managed care into the public mental health system, and directly probe consumer and family member perceptions and experiences of managed care and the policies and practices of managed care organizations.
2294444	Hospitalization accounts for a large portion of the expenditures for child health care, and differences in the rate of hospitalization may produce important variations in the cost of that care. We studied the rates of hospitalization in Boston, Rochester (N.Y.), and New Haven (Conn.) in 1982. We assigned the risk of hospitalization in Rochester a score of 1.00. Boston children were hospitalized at more than twice the rate of Rochester children for most medical diagnostic categories (relative risk, 2.65; 95 percent confidence interval, 2.53 to 2.78), and the rate for the New Haven group was intermediate (relative risk, 1.80; 95 percent confidence interval, 1.68 to 1.93). Rates of inpatient surgery differed less (Boston relative risk, 1.12; New Haven relative risk, 0.93). The relative risks of hospitalization (as compared with Rochester children) for Boston and New Haven children, respectively, were 3.8 and 2.3 for asthma, 6.1 and 2.9 for toxic ingestions, and 2.6 and 2.7 for head injuries. Fractures of the femur, appendicitis, and bacterial meningitis (conditions uniformly treated in the hospital) had similar rates of hospitalization across the three cities, but the relative risk of hospitalization for aseptic meningitis was 3.7 in Boston. The rates of hospitalization of children in all three communities were below the national averages in 1982. Although this study does not define the reasons for the variation in rates of hospitalization, it is possible that they were related in part to differences in socioeconomic status or access to primary care. The implications of these data for the cost and quality of pediatric care therefore remain to be determined.
9031575	These findings suggest the need for a larger, epidemiological study of the psychiatric morbidity of rural children of farm workers.
19188420	The validity of the survey was supported in mail and Internet modes for the American English language, and the instrument was approved by the CAHPS consortium for distribution as the CAHPS Dental Plan Survey. PRACTICE IMPLICATIONS. A tool is available now for assessing dental care quality by measuring adult patients' experiences with their dental care and coverage. The authors tested this instrument only in a population with third-party coverage, however, which is a potential limitation that should be considered.
18053680	To identify aspects of end-of-life care in the U.S. Department of Veterans Affairs (VA) health care system that are not assessed by existing survey instruments and to identify issues that may be unique to veterans, telephone interviews using open-ended questions were conducted with family members of veterans who had received care from a VA facility in the last month of life. Responses were compared to validated end-of-life care assessment instruments in common use. The study took place in four VA medical centers and one family member per patient was invited to participate, selected from medical records using predefined eligibility criteria. These family members were asked to describe positive and negative aspects of the care the veteran received in the last month of life. Interview questions elicited perceptions of care both at VA sites and at non-VA sites. Family reports were coded and compared with items in five existing prospective and retrospective instruments that assess the quality of care that patients receive near the end of life. Interviews were completed with 66 family members and revealed 384 codes describing both positive and negative aspects of care during the last month of life. Almost half of these codes were not represented in any of the five reference instruments (n=174; 45%). These codes, some of which are unique to the veteran population, were grouped into eight categories: information about VA benefits (n=36; 55%), inpatient care (n=36; 55%), access to care (n=33; 50%), transitions in care (n=32; 48%), care that the veteran received at the time of death (n=31; 47%), home care (n=26; 40%), health care facilities (n=12; 18%), and mistakes and complications (n=18; 27%). Although most of the reference instruments assessed some aspect of these categories, they did not fully capture the experiences described by our respondents. These data suggest that many aspects of veterans' end-of-life care that are important to their families are not assessed by existing survey instruments. VA efforts to evaluate end-of-life care for veterans should not only measure common aspects of care (e.g., pain management), but also examine performance in areas that are more specific to the veteran population.
9811291	Parents identified language problems, cultural differences, poverty, lack of health insurance, transportation difficulties, and long waiting times as the major access barriers to health care for Latino children. Language problems can result in adverse health consequences for some children, including poor medical care, misdiagnosis, and inappropriate medication and hospitalization. Low family income is an important independent risk factor among Latino children for suboptimal health and high utilization of health services.
10227311	These domains, which characterize patients' perspectives on end-of-life care, can serve as focal points for improving the quality of end-of-life care.
16336491	The TSQM v. II has equivalent measurement characteristics as the TSQM v. I, yet uses four fewer items and more consistent wording. The value of the Decisional Balance Model for estimation of dosing adherence and medication persistence over time is discussed.
9634265	Daily pain is prevalent among nursing home residents with cancer and is often untreated, particularly among older and minority patients.
15265756	Specific communication practices of multiple professionals in health care settings can impact patient outcomes. This study, conducted at a large Children's Hospital, sought to determine the extent to which patient-centered communication (PCC) affected satisfaction with communication and with care itself. Parents of child patients (N = 195) reported on the communication practices of physicians, nurses, and hospital staff members during their most recent stay in the hospital. Surveys were completed on site. Health care providers' use of PCC behaviors, especially immediacy and perceived listening, was positively associated with satisfaction with care and with communication. In addition, PCC behaviors were perceived to be used more frequently with children in better health than with children with poorer health status.
19093939	Palliative consultations improve outcomes of care, and earlier consultations may confer additional benefit.
3858344	Unlike previous studies that examined specialized populations or were completed some years ago, this survey collected information from a cross-section of patients who were currently receiving various kinds of dental treatment. Although the study disclosed that patients' preferences and perceptions of dentists' performance might vary within and between demographic groups, a more important finding was that, in general, most patients in all demographic groups held common beliefs about how they would like to be treated by their dentists. However, according to the reports of these patients, the dentists did not always behave in ways that were congruent with the patients' preferences. The study showed that patients are sensitive to dentists' behaviors. It should also be noted that dentists are sensitive to patients' behaviors and that dentist-patient relationships may be a source of stress for both patients and dentists. Nevertheless, the responsibility for setting the tone of these relationships rests primarily with the dentist rather than with the patient. Therefore, it is important for dentists to be aware of the needs and preferences of their patients so that they can act in ways that will make patients comfortable and dental treatment a positive experience. The potential that appears to be inherent in good, satisfying dentist-patient relationships for minimizing patient stress and making dentistry a less stressful profession has yet to be fully realized. Dentistry is a two-way street: whatever benefits the patient should in turn benefit the dentist as well.
10649587	The audit-based proxy measures represent a complex but feasible approach to the calculation of performance measures for those programs lacking robust administrative data systems. However, until charts contain more complete diagnostic information (i.e., periodontal charting and diagnostic codes or reason-for-treatment codes), accurate determination of these aspects of clinical performance will be difficult.
17992508	European ICU physicians do not experience difficulties with end-of-life decisions in most cases. Allocation of limited resources is a minor consideration and autonomous choices by patient or family remain unusual. Inter-regional differences were found.
11331691	The PHDS provides a comprehensive, psychometrically valid and reliable assessment of how well health plans and the health care providers working within these plans promote the healthy development of young children. The PHDS seems to differentiate among health care plans and among the different aspects of preventive care provided within a health plan. For the population studied here, there is significant room for improvement in ensuring families and children receive appropriate and family-centered care to promote the healthy development of children between 3 and 48 months old. Because the PHDS is conceptually based on national recommendations for child health supervision, improved performance on the PHDS would indicate greater adherence to these national recommendations and progress toward the achievement of Healthy People 2010 goals. The generalizability of the findings presented in this report are being examined using data collected in 5 statewide Medicaid samples (N = 11 696) and data from the National Survey of Early Childhood Health, which has incorporated most of the PHDS items.
16964898	JCAHO says communication problems were the leading root cause of sentinel events in 2005. The reasons are manifold: a harried environment, a hierarchical staffing system and illegible handwriting, to name a few. This gatefold examines the scope of the problem, including data and risk factors, and offers some strategies for improvement.
17674601	Effective communication between patients and health care providers is a critical element to quality health care. Becoming aware of patients' attitudes, beliefs, biases, and behaviors that may influence patient care can help clinicians improve access to and quality of care. Health care providers should develop a strategic plan for improvement, then implement and evaluate the plan to include structured, continuously improving progress toward achieving cultural competency goals. In this challenging health care environment, health care providers need the skills to explore the meaning of illness, to determine patient's social and family context, and provide patient-centered and culturally competent care.
15248886	The patients in the present study were highly satisfied with the outcome of the treatment and experienced it to be without significant unpleasantness irrespective of the treatment concept.
9471938	Among seriously ill hospitalized adults, communication about preferences for cardiopulmonary resuscitation is uncommon. A majority of patients who have not discussed preferences for end-of-life care do not want to do so. For patients who do not want to discuss their preferences, as well as patients with an unmet need for such discussions, failure to discuss preferences for cardiopulmonary resuscitation and mechanical ventilation may result in unwanted interventions.
2235219	To evaluate access to health care for American children and adolescents, a telephone survey of a national random sample of households was conducted in which 2182 children 17 years or younger were studied. Approximately 10% had no medical insurance; 10% had no regular source of care; and 18% identified emergency rooms, community clinics, or hospital outpatient departments as their usual site of medical care. Children who were uninsured, poor, or nonwhite were less likely to have seen a physician in the past year (P less than .001), and uninsured children were less likely to have up-to-date immunizations. Logistic regression analyses revealed that poor, uninsured, or nonwhite children less frequently had a regular source of care; more frequently used emergency rooms, community clinics, and hospital outpatient departments as their regular providers; and more frequently encountered financial barriers to health care. Low-income or nonwhite children had much less access to care compared with children from more affluent or white families, independent of insurance status or health status.
16334968	Understanding patients' and family members' perspectives on the relative importance of elements of end-of-life (EOL) care and their satisfaction with those elements will help prioritize quality improvement initiatives. We administered a face-to-face questionnaire containing a selection of 28 elements of care to eligible inpatients with advanced lung, heart, or liver disease, or metastatic cancer, and available family caregivers (FCGs) in five tertiary care hospitals across Canada. 440 of 569 (78%) eligible patients and 160 of 176 (91%) FCGs participated. No respondent reported complete satisfaction with all elements of care. The average satisfaction score was 4.6 on a 26 point scale. Medical patients reported lower levels of satisfaction than cancer patients. Elements rated as "extremely important" and anything other than "completely satisfied" most frequently by respondents related to discharge planning, availability of home health services, symptom relief, not being a burden, physician trust, and communication. In conclusion, most patients and their family members in our survey were not completely satisfied with EOL care. Improvement initiatives to target key elements identified by patients and FCGs have the potential to improve satisfaction with EOL care across care settings.
7730685	This article represents the contributions of the panel on "Neuropsychiatric Syndromes and Psychological Symptoms" of the National Cancer Institute of Canada Workshop on Symptom Control and Supportive Care in Patients with Advanced Cancer. The panel's presentations focused on mood disorders and cognitive disorders, and described the current state of knowledge regarding prevalence, assessment, and intervention. Recommendations for future research are presented based on a consensus of the panel as to the need to fill glaring gaps in our current state of knowledge, and a desire to improve the quality of research in this area of palliative medicine. Recommendations for future research on neuropsychiatric symptoms and syndromes in palliative care include (1) adoption of uniform terminology (taxonomy of disorders) and diagnostic classification systems, (2) utilization of existing validated tools and measures in prevalence and intervention research, (3) development of new tools and measures that are more applicable and relevant to the palliative care setting, (4) encouragement for studies of the prevalence of neuropsychiatric symptoms and syndromes, (5) promotion of intervention studies utilizing pharmacologic and nonpharmacologic treatments for depressive disorders and cognitive disorders in advanced cancer patients, and (6) expansion of the focus of such research to other neuropsychiatric disorders (for example, anxiety disorders, posttraumatic stress disorders, and sleep disorders), symptoms (fatigue and tension) and related issues (suicidal ideation and desire for hastened death).
7999421	The Memorial Symptom Assessment Scale (MSAS) is a new patient-rated instrument that was developed to provide multidimensional information about a diverse group of common symptoms. This study evaluated the reliability and validity of the MSAS in the cancer population. Randomly selected inpatients and outpatients (n = 246) with prostate, colon, breast or ovarian cancer were assessed using the MSAS and a battery of measures that independently evaluate phenomena related to quality of life. Symptom prevalence in the 218 evaluable patients ranged from 73.9% for lack of energy to 10.6% for difficulty swallowing. Based on a content analysis, three symptoms were deleted and two were added; the revised scale evaluates 32 physical and psychological symptoms. A factor analysis of variance yielded two factors that distinguished three major symptom groups and several subgroups. The major groups comprised psychological symptoms (PSYCH), high prevalence physical symptoms (PHYS H), and low prevalence physical symptoms (PHYS L). Internal consistency was high in the PHYS H and PSYCH groups (Cronback alpha coefficients of 0.88 and 0.83, respectively), and moderate in the PHYS L group (alpha = 0.58). Although the severity, frequency and distress dimensions were highly intercorrelated, canonical correlations and other analyses demonstrated that multidimensional assessment (frequency and distress) augments information about the impact of symptoms. High correlations with clinical status and quality of life measures support the validity of the MSAS and indicate the utility of several subscale scores, including PSYCH, PHYS, and a brief Global Distress Index. The MSAS is a reliable and valid instrument for the assessment of symptom prevalence, characteristics and distress. It provides a method for comprehensive symptom assessment that may be useful when information about symptoms is desirable, such as clinical trials that incorporate quality of life measures or studies of symptom epidemiology.
9895002	We established the feasibility of operationalizing a noncategorical conceptual definition by using a large-scale data set and provided an estimate of the prevalence of chronic conditions among US children. We confirmed that several sociodemographic correlates of chronic conditions in samples identified through diagnostic checklists were related to the presence of chronic conditions among these children.
22092877	In 2008, the Centers for Medicaid and Medicare Services (CMS) launched the Five-Star Quality Rating System to help consumers compare nursing homes. The quality rating system consists of three domains: nursing home inspection results, staffing, and quality measures (QMs) and an overall rating calculated from the three domains. The Five-Star System has both advocates and detractors. One source of criticism about the rating system is its lack of input from consumer surveys. Although different dimensions of quality have been recognized as important by the experts and studied in the literature, how these dimensions are linked with each other is largely unknown. This article describes an analysis of the relationship between overall experience of care ratings from a family survey and ratings obtained on the CMS Five-Star Quality Rating for Maryland nursing homes. The results indicated a strong positive correlation between family experience of care score and two five-star domains, namely health inspections and nurse staffing, and no relationship with the quality domain. The lack of relationship between the quality domain and the family score may be due to inadequate risk adjustment or that each rating system measures different aspects of quality.
9178792	The characteristics of childhood as a unique developmental stage of life, the continuity of child health with adult health, and a distinctive child health care system justify a separate focus of health services research on children. Child health services research (CHSR) currently lacks the tools necessary to monitor the impact of health system change on children's health and health care and to compare the effectiveness of alternative treatment modalities. There is an urgent need to build the research capacity of this field of inquiry. Ignoring or minimizing attention to CHSR is both shortsighted and ultimately costly for families and the entire nation. We present arguments for why children merit a separate focus in health services research, identify factors that have led to the failure of appropriate development of CHSR, and offer a set of strategies for how to build the research capacity of the field.
17996835	Clinicians should be aware of important barriers to care that may exist for immigrant families who are poor, uninsured, and non-English speakers. Reduced health care access and utilization by children with asthma in immigrant families requires policy attention. Further research should examine barriers to care as well as parental perceptions of health for children with asthma in immigrant families.
15894705	Twenty-one million Americans are limited in English proficiency (LEP), but little is known about the effect of medical interpreter services on health care quality. Asystematic literature review was conducted on the impact of interpreter services on quality of care. Five database searches yielded 2,640 citations and a final database of 36 articles, after applying exclusion criteria. Multiple studies document that quality of care is compromised when LEP patients need but do not get interpreters. LEP patients' quality of care is inferior, and more interpreter errors occur with untrained ad hoc interpreters. Inadequate interpreter services can have serious consequences for patients with mental disorders. Trained professional interpreters and bilingual health care providers positively affect LEP patients' satisfaction, quality of care, and outcomes. Evidence suggests that optimal communication, patient satisfaction, and outcomes and the fewest interpreter errors occur when LEP patients have access to trained professional interpreters or bilingual providers.
11441624	Patients with advanced lung cancer suffer frequent and severe symptoms that worsen in the final months of life. The appropriate timing and combination of radiotherapy and chemotherapy are yet to be resolved. Future studies will require use of validated quality of life instruments to better catalogue palliation and treatment toxicity.
10916961	This study suggests that racial and ethnic minorities and persons with limited English proficiency face barriers to care, despite Medicaid-enabled financial access. Health care organizations should address the observed disparities in access to care for racial/ethnic and linguistic minorities as part of their quality improvement efforts.
8482768	Patients reported little or no pain during or after treatment with a dental laser. With many people reporting fear of pain as their chief reason for not seeking dental care, lasers may offer a more acceptable treatment technique.
15686076	Parents and professional caregivers, although united in their shared goal of returning a sick child to health, do not always view the caregiving situation from the same frame of reference. This article describes the perspectives of more than 50,000 parents whose child experienced a hospitalization. It outlines the greatest opportunities for improving the pediatric inpatient experience from the parent's perspective. In addition, practical tips and strategies for planning improvements in care from the patient/family perspective are offered.
8703185	Major ethnic groups and subgroups of children differ strikingly in demographics, health, and use of services; subgroup differences are easily overlooked; and most disparities persist even after adjustment for family income and parental education.
9100724	In these seriously ill patients, ADs did not substantially enhance physician-patient communication or decision-making about resuscitation. This lack of effect was not altered by the PSDA or by the enhanced efforts in SUPPORT, although these interventions each substantially increased documentation of existing ADs. Current practice patterns indicate that increasing the frequency of ADs is unlikely to be a substantial element in improving the care of seriously ill patients. Future work to improve decision-making should focus upon improving the current pattern of practice through better communication and more comprehensive advance care planning.
9100724	Advance directives placed in the medical records of seriously ill patients often did not guide medical decision-making beyond naming a healthcare proxy or documenting general preferences in a standard living will format. Even when specific instructions were present, care was potentially inconsistent in half of the cases.
8629645	The diagnosis, patients' perception of the prognosis, and hospital site were significantly associated with patients' resuscitation preferences after adjusting for patient demographics, severity of illness, and functional status. The rate of discussing CPR was low even for patients who did not want CPR. Patient preferences not to receive CPR were associated with a small decrease in intensity of care but no difference in hospital survival.
